id	conversation_id	created_at	date	time	timezone	user_id	username	name	place	tweet	language	mentions	urls	photos	replies_count	retweets_count	likes_count	hashtags	cashtags	link	retweet	quote_url	video	thumbnail	near	geo	source	user_rt_id	user_rt	retweet_id	reply_to	retweet_date	translate	trans_src	trans_dest
1489917881412468736	1489917881412468736	2022-02-05 16:34:38 IST	2022-02-05	16:34:38	+0530	1222156587055439872	garyandersonf1	Gary Anderson		RT @wearetherace: 🎧 Ex-#F1 technical director @GaryAndersonF1 gives his verdict on the 2022 Haas car on the latest episode of The Race F1 P…	en	[{'screen_name': 'wearetherace', 'name': 'the race', 'id': '1214181376536141830'}, {'screen_name': 'garyandersonf1', 'name': 'gary anderson', 'id': '1222156587055439872'}]	[]	[]	0	6	0	['f1']	[]	https://twitter.com/GaryAndersonF1/status/1489917881412468736	False		0								[]				
1489596927473852426	1489596927473852426	2022-02-04 19:19:17 IST	2022-02-04	19:19:17	+0530	1222156587055439872	garyandersonf1	Gary Anderson		Here's my look at the new Haas   https://t.co/g5bJaodS98	en	[]	['https://the-race.com/formula-1/gary-anderson-what-haas-images-tell-us-about-2022-f1-cars/']	[]	0	8	69	[]	[]	https://twitter.com/GaryAndersonF1/status/1489596927473852426	False		0								[]				
1483800426776612866	1483800419931496450	2022-01-19 19:26:04 IST	2022-01-19	19:26:04	+0530	1222156587055439872	garyandersonf1	Gary Anderson		From engine to engine you had no idea what you would get. Some would go forever, others would blow up after one or two laps. That, combined with a gearbox problem that we had, meant it was a very stressful season (3/3)	en	[]	[]	[]	6	6	109	[]	[]	https://twitter.com/GaryAndersonF1/status/1483800426776612866	False		0								[]				
1483800424561971202	1483800419931496450	2022-01-19 19:26:03 IST	2022-01-19	19:26:03	+0530	1222156587055439872	garyandersonf1	Gary Anderson		It ran very well for about 6 laps and Alex was really impressed. Unfortunately, on the seventh lap it blew up. We fitted another engine and it was like someone  forgot to connect up all the plug leads! It was a real dog and unfortunately that’s how the season progressed (2/3)	en	[]	[]	[]	2	6	89	[]	[]	https://twitter.com/GaryAndersonF1/status/1483800424561971202	False		0								[]				
1483800419931496450	1483800419931496450	2022-01-19 19:26:02 IST	2022-01-19	19:26:02	+0530	1222156587055439872	garyandersonf1	Gary Anderson		This was a 191 with a Yamaha engine fitted. We modified a chassis by shorting the fuel tank. From memory, we ran it in December with Alex Zanardi driving. We had installed an engine that was a spare for David Brabham at Suzuka (1/3)	en	[]	[]	[]	6	14	248	[]	[]	https://twitter.com/GaryAndersonF1/status/1483800419931496450	False	https://twitter.com/UnracedF1/status/1483542381517582336	0								[]				
1470038740798169093	1470038740798169093	2021-12-12 20:02:02 IST	2021-12-12	20:02:02	+0530	1222156587055439872	garyandersonf1	Gary Anderson		Allowing lapped cars through is what will make or break it	en	[]	[]	[]	10	4	77	[]	[]	https://twitter.com/GaryAndersonF1/status/1470038740798169093	False		0								[]				
1470032192101396489	1470032192101396489	2021-12-12 19:36:01 IST	2021-12-12	19:36:01	+0530	1222156587055439872	garyandersonf1	Gary Anderson		Hamilton sending out the bluff re the tyres	en	[]	[]	[]	8	16	234	[]	[]	https://twitter.com/GaryAndersonF1/status/1470032192101396489	False		0								[]				
1470032148715421696	1470032148715421696	2021-12-12 19:35:50 IST	2021-12-12	19:35:50	+0530	1222156587055439872	garyandersonf1	Gary Anderson		Verstappen has got to keep the gap down to the minimum possible. If Mercedes pit, they will put on mediums for the run to the flag	en	[]	[]	[]	2	3	37	[]	[]	https://twitter.com/GaryAndersonF1/status/1470032148715421696	False		0								[]				
1470030619795152907	1470030619795152907	2021-12-12 19:29:46 IST	2021-12-12	19:29:46	+0530	1222156587055439872	garyandersonf1	Gary Anderson		Verstappen just doing the opposite to Hamilton	en	[]	[]	[]	6	1	39	[]	[]	https://twitter.com/GaryAndersonF1/status/1470030619795152907	False		0								[]				
1470030170396442626	1470030170396442626	2021-12-12 19:27:59 IST	2021-12-12	19:27:59	+0530	1222156587055439872	garyandersonf1	Gary Anderson		VSC coming up	en	[]	[]	[]	0	0	12	[]	[]	https://twitter.com/GaryAndersonF1/status/1470030170396442626	False		0								[]				
1470025092058992642	1470025092058992642	2021-12-12 19:07:48 IST	2021-12-12	19:07:48	+0530	1222156587055439872	garyandersonf1	Gary Anderson		Exciting, but I'm not sure I'm a fan of that style of racing	en	[]	[]	[]	38	12	243	[]	[]	https://twitter.com/GaryAndersonF1/status/1470025092058992642	False		0								[]				
1470022420912390154	1470022420912390154	2021-12-12 18:57:11 IST	2021-12-12	18:57:11	+0530	1222156587055439872	garyandersonf1	Gary Anderson		Personally, I would have gone mediums with a potential stop later for softs or mediums again	en	[]	[]	[]	7	10	75	[]	[]	https://twitter.com/GaryAndersonF1/status/1470022420912390154	False		0								[]				
1470022341174304769	1470022341174304769	2021-12-12 18:56:52 IST	2021-12-12	18:56:52	+0530	1222156587055439872	garyandersonf1	Gary Anderson		If it stays as it is, it's game over for Verstappen. Now's the time to do something different	en	[]	[]	[]	5	13	120	[]	[]	https://twitter.com/GaryAndersonF1/status/1470022341174304769	False		0								[]				
1470019820863332355	1470019820863332355	2021-12-12 18:46:51 IST	2021-12-12	18:46:51	+0530	1222156587055439872	garyandersonf1	Gary Anderson		It was all done at the start. Forget the small coming together, it's not the reason they are running like they are. It's the rest of the race that counts from here	en	[]	[]	[]	2	7	72	[]	[]	https://twitter.com/GaryAndersonF1/status/1470019820863332355	False		0								[]				
1470019288283193347	1470019288283193347	2021-12-12 18:44:44 IST	2021-12-12	18:44:44	+0530	1222156587055439872	garyandersonf1	Gary Anderson		Their coming together was tit for tat	en	[]	[]	[]	12	7	127	[]	[]	https://twitter.com/GaryAndersonF1/status/1470019288283193347	False		0								[]				
1470017128568958987	1470017128568958987	2021-12-12 18:36:09 IST	2021-12-12	18:36:09	+0530	1222156587055439872	garyandersonf1	Gary Anderson		Long wait on pole	en	[]	[]	[]	0	2	29	[]	[]	https://twitter.com/GaryAndersonF1/status/1470017128568958987	False		0								[]				
1470012423520362498	1470012423520362498	2021-12-12 18:17:27 IST	2021-12-12	18:17:27	+0530	1222156587055439872	garyandersonf1	Gary Anderson		Norris needs to forget about the two in front of him. Let them look after themselves and do what he does best	en	[]	[]	[]	9	13	294	[]	[]	https://twitter.com/GaryAndersonF1/status/1470012423520362498	False		0								[]				
1469294141662457863	1469294141662457863	2021-12-10 18:43:16 IST	2021-12-10	18:43:16	+0530	1222156587055439872	garyandersonf1	Gary Anderson		Looks like the same is happening in practice 2 with the Mercedes drivers	en	[]	[]	[]	5	1	78	[]	[]	https://twitter.com/GaryAndersonF1/status/1469294141662457863	False		0								[]				
1469290335486500868	1469290335486500868	2021-12-10 18:28:08 IST	2021-12-10	18:28:08	+0530	1222156587055439872	garyandersonf1	Gary Anderson		Never mind the actual performance in the first session. What I thought was strange was how many times both Mercedes ran wide and lost laps	en	[]	[]	[]	6	7	96	[]	[]	https://twitter.com/GaryAndersonF1/status/1469290335486500868	False		0								[]				
1469243038962753538	1469243038962753538	2021-12-10 15:20:12 IST	2021-12-10	15:20:12	+0530	1222156587055439872	garyandersonf1	Gary Anderson		Pirelli's softest tyre and they are on lap 8/9 on a green track. It’s not looking like we are going to see many pitstops in the race	en	[]	[]	[]	2	7	118	[]	[]	https://twitter.com/GaryAndersonF1/status/1469243038962753538	False		0								[]				
1467589113209622534	1467589113209622534	2021-12-06 01:48:05 IST	2021-12-06	01:48:05	+0530	1222156587055439872	garyandersonf1	Gary Anderson		It was all about who was going to get the DRS. Well done Ant for spotting that	en	[]	[]	[]	48	34	582	[]	[]	https://twitter.com/GaryAndersonF1/status/1467589113209622534	False		0								[]				
1467580015650947085	1467580015650947085	2021-12-06 01:11:56 IST	2021-12-06	01:11:56	+0530	1222156587055439872	garyandersonf1	Gary Anderson		Does anyone out there have any idea what happened in that race?	en	[]	[]	[]	53	15	281	[]	[]	https://twitter.com/GaryAndersonF1/status/1467580015650947085	False		0								[]				
1467578329045811200	1467578329045811200	2021-12-06 01:05:14 IST	2021-12-06	01:05:14	+0530	1222156587055439872	garyandersonf1	Gary Anderson		Wouldn't be surprised if Verstappen has a problem or his tyres are past their sell-by date. As for Hamilton, who needs the front wing and endplates?	en	[]	[]	[]	6	17	224	[]	[]	https://twitter.com/GaryAndersonF1/status/1467578329045811200	False		0								[]				
1467576627316113409	1467576627316113409	2021-12-06 00:58:28 IST	2021-12-06	00:58:28	+0530	1222156587055439872	garyandersonf1	Gary Anderson		Lewis didn't get the info from the team at the correct time. These drivers try to pass each other lap after lap. Hamilton should have been able to achieve that on his own	en	[]	[]	[]	14	28	299	[]	[]	https://twitter.com/GaryAndersonF1/status/1467576627316113409	False		0								[]				
1467571211215454213	1467571211215454213	2021-12-06 00:36:57 IST	2021-12-06	00:36:57	+0530	1222156587055439872	garyandersonf1	Gary Anderson		With all these VSCs, it's getting a bit like NASCAR	en	[]	[]	[]	9	13	216	[]	[]	https://twitter.com/GaryAndersonF1/status/1467571211215454213	False		0								[]				
1467566588845084678	1467566588845084678	2021-12-06 00:18:35 IST	2021-12-06	00:18:35	+0530	1222156587055439872	garyandersonf1	Gary Anderson		You could make a movie of this race alone!	en	[]	[]	[]	8	52	559	[]	[]	https://twitter.com/GaryAndersonF1/status/1467566588845084678	False		0								[]				
1467564012317646854	1467564012317646854	2021-12-06 00:08:21 IST	2021-12-06	00:08:21	+0530	1222156587055439872	garyandersonf1	Gary Anderson		Frustration is high. This could all end up in tears for someone, and in reality that would be nothing to do with the track	en	[]	[]	[]	2	7	135	[]	[]	https://twitter.com/GaryAndersonF1/status/1467564012317646854	False		0								[]				
1467563342189506568	1467563342189506568	2021-12-06 00:05:41 IST	2021-12-06	00:05:41	+0530	1222156587055439872	garyandersonf1	Gary Anderson		I wonder who is going to win this world championship? Hamilton, Verstappen or Michael Masi?	en	[]	[]	[]	155	393	4487	[]	[]	https://twitter.com/GaryAndersonF1/status/1467563342189506568	False		0								[]				
1467562575927861255	1467562575927861255	2021-12-06 00:02:38 IST	2021-12-06	00:02:38	+0530	1222156587055439872	garyandersonf1	Gary Anderson		Who knows what is going on? It shouldn't be about doing deals between the FIA and the team, it should be about implementation of the written rules	en	[]	[]	[]	100	365	2558	[]	[]	https://twitter.com/GaryAndersonF1/status/1467562575927861255	False		0								[]				
1467561654128885768	1467561654128885768	2021-12-05 23:58:58 IST	2021-12-05	23:58:58	+0530	1222156587055439872	garyandersonf1	Gary Anderson		Toto will be on the old 'dog and bone' to the FIA again	en	[]	[]	[]	1	2	57	[]	[]	https://twitter.com/GaryAndersonF1/status/1467561654128885768	False		0								[]				
1467560803796725760	1467560803796725760	2021-12-05 23:55:36 IST	2021-12-05	23:55:36	+0530	1222156587055439872	garyandersonf1	Gary Anderson		The incident with Mazepin hitting Russell is what I fear about these low noses	en	[]	[]	[]	9	5	181	[]	[]	https://twitter.com/GaryAndersonF1/status/1467560803796725760	False		0								[]				
1467560512904904706	1467560512904904706	2021-12-05 23:54:26 IST	2021-12-05	23:54:26	+0530	1222156587055439872	garyandersonf1	Gary Anderson		That was Hamilton's corner. It's going to be tough to sort it out with Ocon getting through into second	en	[]	[]	[]	9	21	272	[]	[]	https://twitter.com/GaryAndersonF1/status/1467560512904904706	False		0								[]				
1467556280671916037	1467556280671916037	2021-12-05 23:37:37 IST	2021-12-05	23:37:37	+0530	1222156587055439872	garyandersonf1	Gary Anderson		The rule on changing tyres during a red flag has been the same for many years. It might not be right but it is what it is	en	[]	[]	[]	40	65	789	[]	[]	https://twitter.com/GaryAndersonF1/status/1467556280671916037	False		0								[]				
1467554738224910337	1467554738224910337	2021-12-05 23:31:30 IST	2021-12-05	23:31:30	+0530	1222156587055439872	garyandersonf1	Gary Anderson		Now we will see the race that would have been if Max had completed his last qualifying lap yesterday	en	[]	[]	[]	29	67	518	[]	[]	https://twitter.com/GaryAndersonF1/status/1467554738224910337	False		0								[]				
1467554216336052230	1467554216336052230	2021-12-05 23:29:25 IST	2021-12-05	23:29:25	+0530	1222156587055439872	garyandersonf1	Gary Anderson		Big decision to throw the red flag. Toto will be on his private line to the FIA...	en	[]	[]	[]	28	18	298	[]	[]	https://twitter.com/GaryAndersonF1/status/1467554216336052230	False		0								[]				
1467553169853100052	1467553169853100052	2021-12-05 23:25:16 IST	2021-12-05	23:25:16	+0530	1222156587055439872	garyandersonf1	Gary Anderson		Bottas should get a time penalty. You're not allowed to go slow on track to allow pitstop stacking	en	[]	[]	[]	73	255	3661	[]	[]	https://twitter.com/GaryAndersonF1/status/1467553169853100052	False		0								[]				
1467550173601705996	1467550173601705996	2021-12-05 23:13:21 IST	2021-12-05	23:13:21	+0530	1222156587055439872	garyandersonf1	Gary Anderson		Seven laps in, 20 cars running, most out of DRS - might be time to have a nap!	en	[]	[]	[]	9	21	183	[]	[]	https://twitter.com/GaryAndersonF1/status/1467550173601705996	False		0								[]				
1467190395536920590	1467190395536920590	2021-12-04 23:23:44 IST	2021-12-04	23:23:44	+0530	1222156587055439872	garyandersonf1	Gary Anderson		Then 57%	en	[]	[]	[]	0	0	18	[]	[]	https://twitter.com/GaryAndersonF1/status/1467190395536920590	False		0								[]				
1467190116208848904	1467190116208848904	2021-12-04 23:22:37 IST	2021-12-04	23:22:37	+0530	1222156587055439872	garyandersonf1	Gary Anderson		That 56 you saw on Hamilton's car was the brake balance - meaning 56% front. They adjust it for different corners	en	[]	[]	[]	0	3	67	[]	[]	https://twitter.com/GaryAndersonF1/status/1467190116208848904	False		0								[]				
1467132442737844230	1467132442737844230	2021-12-04 19:33:27 IST	2021-12-04	19:33:27	+0530	1222156587055439872	garyandersonf1	Gary Anderson		In terms of tyres, the soft might give that little bit extra grip for traction, but the hards will be more stable in the fast corners with the mediums somewhere in between. It will be mediums for Q2	en	[]	[]	[]	1	5	119	[]	[]	https://twitter.com/GaryAndersonF1/status/1467132442737844230	False		0								[]				
1466828743507386375	1466828743507386375	2021-12-03 23:26:39 IST	2021-12-03	23:26:39	+0530	1222156587055439872	garyandersonf1	Gary Anderson		In other words, what Pirelli are saying is that their tyres in Qatar wouldn't take the load the cars were putting them through   https://t.co/P7KX4Q7dIc	en	[]	['https://the-race.com/formula-1/likely-cause-of-f1-qatar-tyre-failures-revealed/']	[]	0	3	34	[]	[]	https://twitter.com/GaryAndersonF1/status/1466828743507386375	False		0								[]				
1466823926219264006	1466823926219264006	2021-12-03 23:07:30 IST	2021-12-03	23:07:30	+0530	1222156587055439872	garyandersonf1	Gary Anderson		A maximum sector time that is something like 105% of an average sector time is all that is needed to prevent this traffic problem. A complete maximum lap time is a waste of time	en	[]	[]	[]	0	9	109	[]	[]	https://twitter.com/GaryAndersonF1/status/1466823926219264006	False		0								[]				
1466774105999429632	1466774105999429632	2021-12-03 19:49:32 IST	2021-12-03	19:49:32	+0530	1222156587055439872	garyandersonf1	Gary Anderson		It's not that the soft tyre is slower than the hard. It is because the balance changes and on softs you get more understeer, so you need a bit of a set-up change to get the best from them	en	[]	[]	[]	6	17	305	[]	[]	https://twitter.com/GaryAndersonF1/status/1466774105999429632	False		0								[]				
1466767272610045962	1466767272610045962	2021-12-03 19:22:23 IST	2021-12-03	19:22:23	+0530	1222156587055439872	garyandersonf1	Gary Anderson		I think we are seeing full Max attack this weekend	en	[]	[]	[]	17	11	257	[]	[]	https://twitter.com/GaryAndersonF1/status/1466767272610045962	False		0								[]				
1466444184580153347	1466444184580153347	2021-12-02 21:58:33 IST	2021-12-02	21:58:33	+0530	1222156587055439872	garyandersonf1	Gary Anderson		Some thoughts on 2022   https://t.co/c21vMGEVx5	en	[]	['https://the-race.com/formula-1/gary-anderson-on-first-hints-of-2022-f1-cars-key-handling-trait/']	[]	0	2	22	[]	[]	https://twitter.com/GaryAndersonF1/status/1466444184580153347	False		0								[]				
1464976779098169344	1464976779098169344	2021-11-28 20:47:36 IST	2021-11-28	20:47:36	+0530	1222156587055439872	garyandersonf1	Gary Anderson		Very sad to hear about Sir Frank Williams passing away. He defied all the odds with his team and their winning ways - plus his own personal battle for life. RIP Frank and love to the family	en	[]	[]	[]	2	38	1086	[]	[]	https://twitter.com/GaryAndersonF1/status/1464976779098169344	False		0								[]				
1462428066664394762	1462428066664394762	2021-11-21 19:59:56 IST	2021-11-21	19:59:56	+0530	1222156587055439872	garyandersonf1	Gary Anderson		Alonso 32s behind Hamilton on lap 17. That's just about 2 seconds a lap	en	[]	[]	[]	3	8	64	[]	[]	https://twitter.com/GaryAndersonF1/status/1462428066664394762	False		0								[]				
1462408255070773248	1462408248611512322	2021-11-21 18:41:12 IST	2021-11-21	18:41:12	+0530	1222156587055439872	garyandersonf1	Gary Anderson		Today, Max Verstappen being given a 5-place grid penalty for not seeing a double waved yellow flag that shouldn't have been out there is again wrong. Yes, delete that lap time from anyone that didn't comply and then there is no advantage for not slowing, but no grid penalty (2/2)	en	[]	[]	[]	52	62	663	[]	[]	https://twitter.com/GaryAndersonF1/status/1462408255070773248	False		0								[]				
1462408248611512322	1462408248611512322	2021-11-21 18:41:11 IST	2021-11-21	18:41:11	+0530	1222156587055439872	garyandersonf1	Gary Anderson		These last two races have shown that the FIA has lost control of policing F1. If Lewis Hamilton's rear wing was only 0.2mm out of regulation and it was caused by two loose fastenings, then he should not have been put to the back of the grid (1/2)	en	[]	[]	[]	56	108	1243	[]	[]	https://twitter.com/GaryAndersonF1/status/1462408248611512322	False		0								[]				
1462073172086374406	1462073172086374406	2021-11-20 20:29:42 IST	2021-11-20	20:29:42	+0530	1222156587055439872	garyandersonf1	Gary Anderson		Still the last run to go, but a pat on the back for AlphaTauri and especially Gasly. Some day someone will realise how good he is when the team treats him as AT do	en	[]	[]	[]	8	8	245	[]	[]	https://twitter.com/GaryAndersonF1/status/1462073172086374406	False		0								[]				
1462059853753602052	1462059853753602052	2021-11-20 19:36:47 IST	2021-11-20	19:36:47	+0530	1222156587055439872	garyandersonf1	Gary Anderson		Gasly feels he can get through into Q2 using the mediums, which means he will have an extra set of new softs for Q2 and/or Q3	en	[]	[]	[]	1	5	87	[]	[]	https://twitter.com/GaryAndersonF1/status/1462059853753602052	False		0								[]				
1462054934929625094	1462054934929625094	2021-11-20 19:17:14 IST	2021-11-20	19:17:14	+0530	1222156587055439872	garyandersonf1	Gary Anderson		I suppose you could say both Red Bull and Mercedes are running on a 'wing' and a prayer	en	[]	[]	[]	16	8	184	[]	[]	https://twitter.com/GaryAndersonF1/status/1462054934929625094	False		0								[]				
1462026342300585988	1462026342300585988	2021-11-20 17:23:37 IST	2021-11-20	17:23:37	+0530	1222156587055439872	garyandersonf1	Gary Anderson		As far as the DRS rules are concerned, the wing slot gap must be no less than 10mm and no more than 15mm when closed and no more than 85mm when open. As long as the wing, when open, is fluttering from 85mm to less than 85mm it's legal. Structural failure would be my biggest worry	en	[]	[]	[]	12	17	239	[]	[]	https://twitter.com/GaryAndersonF1/status/1462026342300585988	False		0								[]				
1462024597814095877	1462024597814095877	2021-11-20 17:16:41 IST	2021-11-20	17:16:41	+0530	1222156587055439872	garyandersonf1	Gary Anderson		Can someone get that in writing from Ted?	en	[]	[]	[]	1	2	34	[]	[]	https://twitter.com/GaryAndersonF1/status/1462024597814095877	False		0								[]				
1462015826639339520	1462015826639339520	2021-11-20 16:41:50 IST	2021-11-20	16:41:50	+0530	1222156587055439872	garyandersonf1	Gary Anderson		It's been said before, and it will be said again. Red Bull gives you wings!	en	[]	[]	[]	9	7	130	[]	[]	https://twitter.com/GaryAndersonF1/status/1462015826639339520	False		0								[]				
1461707709586227201	1461707706524483587	2021-11-19 20:17:29 IST	2021-11-19	20:17:29	+0530	1222156587055439872	garyandersonf1	Gary Anderson		On the Red Bull, it looks like that is what is happening and it is enough to generate that flutter on the flap - but not every time. My worry would be fatigue over a race distance when you are running in traffic (2/2)	en	[]	[]	[]	5	4	75	[]	[]	https://twitter.com/GaryAndersonF1/status/1461707709586227201	False		0								[]				
1461707706524483587	1461707706524483587	2021-11-19 20:17:29 IST	2021-11-19	20:17:29	+0530	1222156587055439872	garyandersonf1	Gary Anderson		When the DRS actuator opens the rear wing flap, it will go against a stop. However, if the flap is still generating some downforce in its own right then as the speed increases, that load increases and could overcome the force of the DRS actuator (1/2)	en	[]	[]	[]	3	7	118	[]	[]	https://twitter.com/GaryAndersonF1/status/1461707706524483587	False		0								[]				
1461700838829830148	1461700838829830148	2021-11-19 19:50:11 IST	2021-11-19	19:50:11	+0530	1222156587055439872	garyandersonf1	Gary Anderson		At what point do you measure the slot gap on Verstappen's rear wing? It won't be oscillating in the pits like that	en	[]	[]	[]	23	6	197	[]	[]	https://twitter.com/GaryAndersonF1/status/1461700838829830148	False		0								[]				
1459953152174792708	1459953152174792708	2021-11-15 00:05:30 IST	2021-11-15	00:05:30	+0530	1222156587055439872	garyandersonf1	Gary Anderson		As last week, I think this pitting late for tyres to do the fastest lap is not sporting	en	[]	[]	[]	34	14	240	[]	[]	https://twitter.com/GaryAndersonF1/status/1459953152174792708	False		0								[]				
1459951505411395592	1459951505411395592	2021-11-14 23:58:58 IST	2021-11-14	23:58:58	+0530	1222156587055439872	garyandersonf1	Gary Anderson		In anyone's books, 20th to fifth in 24 laps and 10th to first in a 71-lap race is an incredible achievement. Straightline speed advantage or not, you have still got to use it and Lewis Hamilton certainly did that	en	[]	[]	[]	33	220	2833	[]	[]	https://twitter.com/GaryAndersonF1/status/1459951505411395592	False		0								[]				
1459946178947207171	1459946178947207171	2021-11-14 23:37:48 IST	2021-11-14	23:37:48	+0530	1222156587055439872	garyandersonf1	Gary Anderson		That will generate a bit of radio traffic	en	[]	[]	[]	3	7	151	[]	[]	https://twitter.com/GaryAndersonF1/status/1459946178947207171	False		0								[]				
1459938941256224768	1459938941256224768	2021-11-14 23:09:02 IST	2021-11-14	23:09:02	+0530	1222156587055439872	garyandersonf1	Gary Anderson		Max sending out the dummy about tyres. There's still not a big enough gap to pit. He would come out around eighth	en	[]	[]	[]	0	3	43	[]	[]	https://twitter.com/GaryAndersonF1/status/1459938941256224768	False		0								[]				
1459929837380984833	1459929837380984833	2021-11-14 22:32:52 IST	2021-11-14	22:32:52	+0530	1222156587055439872	garyandersonf1	Gary Anderson		The shade won't have any impact on the tyre temp as they are all in blankets bringing them up to the same temperature	en	[]	[]	[]	1	1	29	[]	[]	https://twitter.com/GaryAndersonF1/status/1459929837380984833	False		0								[]				
1459928070945660937	1459928070945660937	2021-11-14 22:25:50 IST	2021-11-14	22:25:50	+0530	1222156587055439872	garyandersonf1	Gary Anderson		Toto and Christian just need to kiss and make up	en	[]	[]	[]	11	17	211	[]	[]	https://twitter.com/GaryAndersonF1/status/1459928070945660937	False		0								[]				
1459628465775382531	1459628465775382531	2021-11-14 02:35:19 IST	2021-11-14	02:35:19	+0530	1222156587055439872	garyandersonf1	Gary Anderson		Some thoughts on the Mercedes rear wing verdict   https://t.co/1KP0QTimx2	en	[]	['https://the-race.com/formula-1/gary-anderson-key-lessons-from-the-hamilton-wing-controversy/']	[]	4	2	20	[]	[]	https://twitter.com/GaryAndersonF1/status/1459628465775382531	False		0								[]				
1459613718409580552	1459613718409580552	2021-11-14 01:36:43 IST	2021-11-14	01:36:43	+0530	1222156587055439872	garyandersonf1	Gary Anderson		Good race and a justified result. Lewis definitely showed his talent level there	en	[]	[]	[]	21	20	402	[]	[]	https://twitter.com/GaryAndersonF1/status/1459613718409580552	False		0								[]				
1459608321527320578	1459608321527320578	2021-11-14 01:15:16 IST	2021-11-14	01:15:16	+0530	1222156587055439872	garyandersonf1	Gary Anderson		Big advantage with soft tyres off the grid	en	[]	[]	[]	3	4	33	[]	[]	https://twitter.com/GaryAndersonF1/status/1459608321527320578	False		0								[]				
1459599258890522629	1459599258890522629	2021-11-14 00:39:16 IST	2021-11-14	00:39:16	+0530	1222156587055439872	garyandersonf1	Gary Anderson		Actually, the track is flatter back where Lewis is. It's uphill in front of him and he is also on the racing line, so has a clean track	en	[]	[]	[]	9	3	111	[]	[]	https://twitter.com/GaryAndersonF1/status/1459599258890522629	False		0								[]				
