id	conversation_id	created_at	date	time	timezone	user_id	username	name	place	tweet	language	mentions	urls	photos	replies_count	retweets_count	likes_count	hashtags	cashtags	link	retweet	quote_url	video	thumbnail	near	geo	source	user_rt_id	user_rt	retweet_id	reply_to	retweet_date	translate	trans_src	trans_dest
1305158616551501825	1305158616551501825	2020-09-13 20:27:17 IST	2020-09-13	20:27:17	+0530	1222156587055439872	garyandersonf1	Gary Anderson		At least for the Ferrari fans, there's been a red car in the lead!	en	[]	[]	[]	6	11	122	[]	[]	https://twitter.com/GaryAndersonF1/status/1305158616551501825	False		0								[]				
1305148608220626944	1305148608220626944	2020-09-13 19:47:31 IST	2020-09-13	19:47:31	+0530	1222156587055439872	garyandersonf1	Gary Anderson		Mirror, signal, manoeuvre...I hate DRS	en	[]	[]	[]	24	29	483	[]	[]	https://twitter.com/GaryAndersonF1/status/1305148608220626944	False		0								[]				
1305139230809772039	1305139230809772039	2020-09-13 19:10:15 IST	2020-09-13	19:10:15	+0530	1222156587055439872	garyandersonf1	Gary Anderson		Ideal circumstances to test my proposal to allow drivers to fit fresh tyres under the red flag in case they have a puncture as long as they are the same compound that were taken off. They would then still have to stop to comply with the two-compound regulation	en	[]	[]	[]	5	7	83	[]	[]	https://twitter.com/GaryAndersonF1/status/1305139230809772039	False		0								[]				
1305138573595770880	1305138573595770880	2020-09-13 19:07:38 IST	2020-09-13	19:07:38	+0530	1222156587055439872	garyandersonf1	Gary Anderson		Boys will be boys! What happened to the old saying that you can't win a race at the first corner but you can definitely lose it?	en	[]	[]	[]	2	21	159	[]	[]	https://twitter.com/GaryAndersonF1/status/1305138573595770880	False		0								[]				
1304788015710187521	1304788015710187521	2020-09-12 19:54:39 IST	2020-09-12	19:54:39	+0530	1222156587055439872	garyandersonf1	Gary Anderson		Amazing the difference a week makes to grid positions for Ferrari. Leclerc 13th and around 1.75% slower at Monza but now 5th and still 1.5% down on Hamilton, who was up front on both occasions	en	[]	[]	[]	5	4	52	[]	[]	https://twitter.com/GaryAndersonF1/status/1304788015710187521	False		0								[]				
1304729214424412162	1304729214424412162	2020-09-12 16:01:00 IST	2020-09-12	16:01:00	+0530	1222156587055439872	garyandersonf1	Gary Anderson		I think the lack of running at a new and quite difficult track like Mugello shows that a two day weekend should be the norm	en	[]	[]	[]	11	17	298	[]	[]	https://twitter.com/GaryAndersonF1/status/1304729214424412162	False		0								[]				
1304541824204394496	1304541822400770053	2020-09-12 03:36:22 IST	2020-09-12	03:36:22	+0530	1222156587055439872	garyandersonf1	Gary Anderson		Because it’s close to the ground, it works in what’s called ground effect so it's very efficient at producing downforce (2/2)	en	[]	[]	[]	2	0	14	[]	[]	https://twitter.com/GaryAndersonF1/status/1304541824204394496	False		0								[]				
1304541822400770053	1304541822400770053	2020-09-12 03:36:22 IST	2020-09-12	03:36:22	+0530	1222156587055439872	garyandersonf1	Gary Anderson		To a very small extent, yes. More importantly, it acts as a flap section for the FIA-mandated neutral centre section of the front wing. It's as close to this part as the regs allow anything to be in this area and pulls airflow through underneath this wing section... (1/2)	en	[]	[]	[]	1	0	14	[]	[]	https://twitter.com/GaryAndersonF1/status/1304541822400770053	False	https://twitter.com/RayanMotorsport/status/1304519752266788864	0								[]				
1303983201946415104	1303983201946415104	2020-09-10 14:36:36 IST	2020-09-10	14:36:36	+0530	1222156587055439872	garyandersonf1	Gary Anderson		RT @wearetherace: Having played his part in a considerable number of underdog successes, ex-#F1 tech director @GaryAndersonF1 reflects on P…	en	[{'screen_name': 'wearetherace', 'name': 'the race', 'id': '1214181376536141830'}, {'screen_name': 'garyandersonf1', 'name': 'gary anderson', 'id': '1222156587055439872'}]	[]	[]	0	2	0	['f1']	[]	https://twitter.com/GaryAndersonF1/status/1303983201946415104	False		0								[]				
1303983159294537728	1303983159294537728	2020-09-10 14:36:26 IST	2020-09-10	14:36:26	+0530	1222156587055439872	garyandersonf1	Gary Anderson		I think this is the wrong move for Racing Point. It's too early and puts the wrong pressures on them. I hope Sergio Perez gets a drive for 2021 that respects his talents	en	[]	[]	[]	21	32	286	[]	[]	https://twitter.com/GaryAndersonF1/status/1303983159294537728	False		0								[]				
1303259967068221442	1303259967068221442	2020-09-08 14:42:44 IST	2020-09-08	14:42:44	+0530	1222156587055439872	garyandersonf1	Gary Anderson		There's nothing I enjoy more than an underdog putting one over the big teams!   https://t.co/k8mIwO7ajp	en	[]	['https://podcasts.apple.com/gb/podcast/garys-verdict-on-a-crazy-italian-gp-and-a-surprise-f1-winner/id1502430647?i=1000490383296?i=1000490383296']	[]	2	1	31	[]	[]	https://twitter.com/GaryAndersonF1/status/1303259967068221442	False		0								[]				
1302883458432282624	1302883458432282624	2020-09-07 13:46:37 IST	2020-09-07	13:46:37	+0530	1222156587055439872	garyandersonf1	Gary Anderson		Any questions about Pierre Gasly, AlphaTauri and F1 small-team victories for my next podcast?	en	[]	[]	[]	44	5	75	[]	[]	https://twitter.com/GaryAndersonF1/status/1302883458432282624	False		0								[]				
1302622894732849156	1302622894732849156	2020-09-06 20:31:14 IST	2020-09-06	20:31:14	+0530	1222156587055439872	garyandersonf1	Gary Anderson		What a podium!	en	[]	[]	[]	1	1	47	[]	[]	https://twitter.com/GaryAndersonF1/status/1302622894732849156	False		0								[]				
1302622786989576192	1302622786989576192	2020-09-06 20:30:48 IST	2020-09-06	20:30:48	+0530	1222156587055439872	garyandersonf1	Gary Anderson		This is what I call a race!	en	[]	[]	[]	2	8	140	[]	[]	https://twitter.com/GaryAndersonF1/status/1302622786989576192	False		0								[]				
1302615432936009730	1302615432936009730	2020-09-06 20:01:35 IST	2020-09-06	20:01:35	+0530	1222156587055439872	garyandersonf1	Gary Anderson		These are the sort of races I used to love when you work for a small team	en	[]	[]	[]	5	17	264	[]	[]	https://twitter.com/GaryAndersonF1/status/1302615432936009730	False		0								[]				
1302611043726786560	1302611043726786560	2020-09-06 19:44:08 IST	2020-09-06	19:44:08	+0530	1222156587055439872	garyandersonf1	Gary Anderson		Now we might just have a race on our hands!	en	[]	[]	[]	2	5	52	[]	[]	https://twitter.com/GaryAndersonF1/status/1302611043726786560	False		0								[]				
1302608948953067522	1302608948953067522	2020-09-06 19:35:49 IST	2020-09-06	19:35:49	+0530	1222156587055439872	garyandersonf1	Gary Anderson		There's a little bit of confusion on the Mercedes pit wall	en	[]	[]	[]	6	3	70	[]	[]	https://twitter.com/GaryAndersonF1/status/1302608948953067522	False		0								[]				
1302600172841717765	1302600172841717765	2020-09-06 19:00:57 IST	2020-09-06	19:00:57	+0530	1222156587055439872	garyandersonf1	Gary Anderson		Bottas is trying to cool the car	en	[]	[]	[]	2	4	39	[]	[]	https://twitter.com/GaryAndersonF1/status/1302600172841717765	False		0								[]				
1302593769708158979	1302593769708158979	2020-09-06 18:35:30 IST	2020-09-06	18:35:30	+0530	1222156587055439872	garyandersonf1	Gary Anderson		Keep an eye on Perez. He's fast in all the speed traps	en	[]	[]	[]	2	10	63	[]	[]	https://twitter.com/GaryAndersonF1/status/1302593769708158979	False		0								[]				
1302206835848552448	1302206834711957505	2020-09-05 16:57:58 IST	2020-09-05	16:57:58	+0530	1222156587055439872	garyandersonf1	Gary Anderson		If a car is deemed to have been outside the track limits at the Parabolica then that lap and the following lap needs to be deleted. (2/2)	en	[]	[]	[]	4	3	78	[]	[]	https://twitter.com/GaryAndersonF1/status/1302206835848552448	False		0								[]				
1302206834711957505	1302206834711957505	2020-09-05 16:57:57 IST	2020-09-05	16:57:57	+0530	1222156587055439872	garyandersonf1	Gary Anderson		On his best lap, Bottas was definitely outside track limits out of Parabolica. Sorry, I mean the new new track limit not yesterday’s track limit, or the written regulation track limit, or the Spa track limit but the new new track limit even the commentators don’t understand (1/2)	en	[]	[]	[]	9	11	177	[]	[]	https://twitter.com/GaryAndersonF1/status/1302206834711957505	False		0								[]				
1300492031630999556	1300492031630999556	2020-08-31 23:23:56 IST	2020-08-31	23:23:56	+0530	1222156587055439872	garyandersonf1	Gary Anderson		I'll be taking your questions about F1 2020 - particularly what happened in Belgium and for the next race at Monza-  in my next podcast episode. What would you like to know?	en	[]	[]	[]	52	3	43	[]	[]	https://twitter.com/GaryAndersonF1/status/1300492031630999556	False		0								[]				
1300072440702345217	1300072440702345217	2020-08-30 19:36:38 IST	2020-08-30	19:36:38	+0530	1222156587055439872	garyandersonf1	Gary Anderson		That was an engine air valve pressure top up for Leclerc at the pitstop.	en	[]	[]	[]	1	31	132	[]	[]	https://twitter.com/GaryAndersonF1/status/1300072440702345217	False		0								[]				
1300065620604719105	1300065620604719105	2020-08-30 19:09:32 IST	2020-08-30	19:09:32	+0530	1222156587055439872	garyandersonf1	Gary Anderson		In that first part of the race, it only took until lap six for Hamilton to build a big enough lead to pit and come out in front of the Ferraris!	en	[]	[]	[]	6	16	117	[]	[]	https://twitter.com/GaryAndersonF1/status/1300065620604719105	False		0								[]				
1300065401859121158	1300065401859121158	2020-08-30 19:08:40 IST	2020-08-30	19:08:40	+0530	1222156587055439872	garyandersonf1	Gary Anderson		Thanks for the halo, FIA.	en	[]	[]	[]	11	75	829	[]	[]	https://twitter.com/GaryAndersonF1/status/1300065401859121158	False		0								[]				
1299704856668708864	1299704856668708864	2020-08-29 19:15:59 IST	2020-08-29	19:15:59	+0530	1222156587055439872	garyandersonf1	Gary Anderson		Ferrari had kept something for when they needed it - enough to get in front of Russell in the Williams	en	[]	[]	[]	5	12	144	[]	[]	https://twitter.com/GaryAndersonF1/status/1299704856668708864	False		0								[]				
1299696655525085188	1299696655525085188	2020-08-29 18:43:24 IST	2020-08-29	18:43:24	+0530	1222156587055439872	garyandersonf1	Gary Anderson		I'm expecting the Bus Stop to live up to its name during qualifying. Ridiculous that this keeps happening	en	[]	[]	[]	6	5	62	[]	[]	https://twitter.com/GaryAndersonF1/status/1299696655525085188	False		0								[]				
1299668091337666560	1299668091337666560	2020-08-29 16:49:54 IST	2020-08-29	16:49:54	+0530	1222156587055439872	garyandersonf1	Gary Anderson		oops! 😂  https://t.co/DtFc2ruqZP	en	[]	[]	['https://pbs.twimg.com/media/EglXF04XgAI5Hqb.png']	6	0	16	[]	[]	https://twitter.com/GaryAndersonF1/status/1299668091337666560	False		1	https://pbs.twimg.com/media/EglXF04XgAI5Hqb.png							[]				
1299662670866587648	1299662670866587648	2020-08-29 16:28:21 IST	2020-08-29	16:28:21	+0530	1222156587055439872	garyandersonf1	Gary Anderson		A picture says a thousand words  https://t.co/qtA6jUmtmD	en	[]	[]	['https://pbs.twimg.com/media/EglUQ3-XkAAU0JH.jpg', 'https://pbs.twimg.com/media/EglUQ37WAAEFCr3.png']	20	29	240	[]	[]	https://twitter.com/GaryAndersonF1/status/1299662670866587648	False		1	https://pbs.twimg.com/media/EglUQ3-XkAAU0JH.jpg							[]				
1299657464833552384	1299657464833552384	2020-08-29 16:07:40 IST	2020-08-29	16:07:40	+0530	1222156587055439872	garyandersonf1	Gary Anderson		Yesterday and today so far, Vettel in his Ferrari is sandwiched between two Williams cars. What a difference a year makes...	en	[]	[]	[]	12	7	96	[]	[]	https://twitter.com/GaryAndersonF1/status/1299657464833552384	False		0								[]				
1299650574481272833	1299650574481272833	2020-08-29 15:40:17 IST	2020-08-29	15:40:17	+0530	1222156587055439872	garyandersonf1	Gary Anderson		If it rains for qualifying and/or the race, Mercedes will disappear into the distance. They probably will in the dry as well, but the extra wing they are running will really come into play in the wet	en	[]	[]	[]	2	23	110	[]	[]	https://twitter.com/GaryAndersonF1/status/1299650574481272833	False		0								[]				
1299346243450294272	1299346243450294272	2020-08-28 19:30:59 IST	2020-08-28	19:30:59	+0530	1222156587055439872	garyandersonf1	Gary Anderson		For the race, being quick in sectors 1 and 3 is critical for overtaking. That means overall sector time and speed.	en	[]	[]	[]	3	2	43	[]	[]	https://twitter.com/GaryAndersonF1/status/1299346243450294272	False		0								[]				
1299046888017219584	1299046888017219584	2020-08-27 23:41:27 IST	2020-08-27	23:41:27	+0530	1222156587055439872	garyandersonf1	Gary Anderson		I answer your questions   https://t.co/YxF2AQ7hZE	en	[]	['https://the-race.com/formula-1/podcast-gary-anderson-answers-your-f1-design-questions/']	[]	2	3	23	[]	[]	https://twitter.com/GaryAndersonF1/status/1299046888017219584	False		0								[]				
1297827333974503424	1297827333974503424	2020-08-24 14:55:23 IST	2020-08-24	14:55:23	+0530	1222156587055439872	garyandersonf1	Gary Anderson		On my last podcast, I worked through listener suggestions for how to improve F1   https://t.co/iI7EEL62Iq	en	[]	['https://the-race.com/formula-1/gary-anderson-podcast-your-ideas-for-spicing-up-f1-racing/']	[]	2	2	15	[]	[]	https://twitter.com/GaryAndersonF1/status/1297827333974503424	False		0								[]				
1297659870171353092	1297659870171353092	2020-08-24 03:49:57 IST	2020-08-24	03:49:57	+0530	1222156587055439872	garyandersonf1	Gary Anderson		Well done Taku! You drove brilliantly and deserved the win.	en	[]	[]	[]	3	17	156	[]	[]	https://twitter.com/GaryAndersonF1/status/1297659870171353092	False		0								[]				
1296380337153597440	1296380337153597440	2020-08-20 15:05:32 IST	2020-08-20	15:05:32	+0530	1222156587055439872	garyandersonf1	Gary Anderson		Thanks for your many suggestions for ways to improve F1. I try and work through as many as possible of them in my latest podcast   https://t.co/iI7EEL62Iq	en	[]	['https://the-race.com/formula-1/gary-anderson-podcast-your-ideas-for-spicing-up-f1-racing/']	[]	4	4	35	[]	[]	https://twitter.com/GaryAndersonF1/status/1296380337153597440	False		0								[]				
1295290611193589760	1295290611193589760	2020-08-17 14:55:21 IST	2020-08-17	14:55:21	+0530	1222156587055439872	garyandersonf1	Gary Anderson		After a boring race, I'm looking for suggestions for how to make F1 more exciting. What would you do? Let me know, and I'll talk through as many of your ideas as I can on the next Gary Anderson F1 Show podcast (out Wednesday)	en	[]	[]	[]	361	10	154	[]	[]	https://twitter.com/GaryAndersonF1/status/1295290611193589760	False		0								[]				
1294992416785739776	1294992416785739776	2020-08-16 19:10:26 IST	2020-08-16	19:10:26	+0530	1222156587055439872	garyandersonf1	Gary Anderson		17 laps in and Hamilton leading can pit and come out P3. Hmmmm...	en	[]	[]	[]	2	3	36	[]	[]	https://twitter.com/GaryAndersonF1/status/1294992416785739776	False		0								[]				
1292095488150339585	1292095488150339585	2020-08-08 19:19:05 IST	2020-08-08	19:19:05	+0530	1222156587055439872	garyandersonf1	Gary Anderson		Vettel looks like he is going through the same mental turmoil against Leclerc as he did against Ricciardo at Red Bull in 2014	en	[]	[]	[]	40	46	568	[]	[]	https://twitter.com/GaryAndersonF1/status/1292095488150339585	False		0								[]				
1292051403742089216	1292051403742089216	2020-08-08 16:23:54 IST	2020-08-08	16:23:54	+0530	1222156587055439872	garyandersonf1	Gary Anderson		Interesting that Verstappen dosnt appear to free the car up coming out of Chapel onto Hangar Straight. Others use all the road plus, yet he stays mid track	en	[]	[]	[]	5	4	53	[]	[]	https://twitter.com/GaryAndersonF1/status/1292051403742089216	False		0								[]				
1291701577561124864	1291701577561124864	2020-08-07 17:13:49 IST	2020-08-07	17:13:49	+0530	1222156587055439872	garyandersonf1	Gary Anderson		Great (for the viewer) to be able to see some visible blisters on the rear tyres as opposed to just hearing the driver moaning about tyre condition.	en	[]	[]	[]	0	3	34	[]	[]	https://twitter.com/GaryAndersonF1/status/1291701577561124864	False		0								[]				
1291692724933066752	1291692724933066752	2020-08-07 16:38:38 IST	2020-08-07	16:38:38	+0530	1222156587055439872	garyandersonf1	Gary Anderson		Someone needs to look at the kerb drop off in the middle of the Beckets complex. I know the drivers shouldn't be out there, but it can very easily be a tyre and, more importantly, a chassis destroyed.	en	[]	[]	[]	7	3	38	[]	[]	https://twitter.com/GaryAndersonF1/status/1291692724933066752	False		0								[]				
1290552798640246784	1290552798640246784	2020-08-04 13:08:59 IST	2020-08-04	13:08:59	+0530	1222156587055439872	garyandersonf1	Gary Anderson		Any suggestions for the opening question on the next edition of my podcast?	en	[]	[]	[]	26	0	14	[]	[]	https://twitter.com/GaryAndersonF1/status/1290552798640246784	False		0								[]				
1289938069257240577	1289938069257240577	2020-08-02 20:26:16 IST	2020-08-02	20:26:16	+0530	1222156587055439872	garyandersonf1	Gary Anderson		Minimum front tyre pressure for next week will be about 2psi higher!	en	[]	[]	[]	10	19	221	[]	[]	https://twitter.com/GaryAndersonF1/status/1289938069257240577	False		0								[]				
1289920675281432577	1289920675281432577	2020-08-02 19:17:09 IST	2020-08-02	19:17:09	+0530	1222156587055439872	garyandersonf1	Gary Anderson		To me, in Kvyat's crash it looked like something in the right rear suspension, or the tyre was deflated	en	[]	[]	[]	10	13	132	[]	[]	https://twitter.com/GaryAndersonF1/status/1289920675281432577	False		0								[]				
1289916620278702080	1289916620278702080	2020-08-02 19:01:02 IST	2020-08-02	19:01:02	+0530	1222156587055439872	garyandersonf1	Gary Anderson		Let's have a sulk for The Hulk, who should be in this race!	en	[]	[]	[]	3	3	149	[]	[]	https://twitter.com/GaryAndersonF1/status/1289916620278702080	False		0								[]				
1289565913365139461	1289565913365139461	2020-08-01 19:47:27 IST	2020-08-01	19:47:27	+0530	1222156587055439872	garyandersonf1	Gary Anderson		0.097 seconds out with my pole position time prediction. Must try harder in future.	en	[]	[]	[]	4	4	171	[]	[]	https://twitter.com/GaryAndersonF1/status/1289565913365139461	False		0								[]				
1289561394459734017	1289561394459734017	2020-08-01 19:29:29 IST	2020-08-01	19:29:29	+0530	1222156587055439872	garyandersonf1	Gary Anderson		Two Merc, a Red Bull, a Ferrari and a Racing Point (just) start the race on mediums. Now it's pull those seatbelts extra tight and wring the cars neck. A 1:24.4s for pole anyone?	en	[]	[]	[]	3	1	39	[]	[]	https://twitter.com/GaryAndersonF1/status/1289561394459734017	False		0								[]				
1289553960622264320	1289553960622264320	2020-08-01 18:59:57 IST	2020-08-01	18:59:57	+0530	1222156587055439872	garyandersonf1	Gary Anderson		Only Mercedes can risk using medium tyres for this session. Way too risky for anyone else.	en	[]	[]	[]	3	5	23	[]	[]	https://twitter.com/GaryAndersonF1/status/1289553960622264320	False		0								[]				
1289553135585890304	1289553135585890304	2020-08-01 18:56:40 IST	2020-08-01	18:56:40	+0530	1222156587055439872	garyandersonf1	Gary Anderson		Now it will be the big challenge - low 1:26s will required to get into Q3	en	[]	[]	[]	2	2	15	[]	[]	https://twitter.com/GaryAndersonF1/status/1289553135585890304	False		0								[]				
1289549566497284096	1289549566497284096	2020-08-01 18:42:29 IST	2020-08-01	18:42:29	+0530	1222156587055439872	garyandersonf1	Gary Anderson		This backing up into Vale must be stoped. It's no big drama at Silverstone as you can see slow cars but at some other circuits it's downright dangerous.	en	[]	[]	[]	4	3	48	[]	[]	https://twitter.com/GaryAndersonF1/status/1289549566497284096	False		0								[]				
1289548042270470147	1289548042270470147	2020-08-01 18:36:26 IST	2020-08-01	18:36:26	+0530	1222156587055439872	garyandersonf1	Gary Anderson		You will need to be fairly well into the 1:26s to get through to Q2	en	[]	[]	[]	0	1	8	[]	[]	https://twitter.com/GaryAndersonF1/status/1289548042270470147	False		0								[]				
1289533381072441345	1289515741134217216	2020-08-01 17:38:11 IST	2020-08-01	17:38:11	+0530	1222156587055439872	garyandersonf1	Gary Anderson		@JennieGow Hi Jennie. We haven't seen many in-car shots to see when they are using it, but I don't think so. They are obviously very good on saving tyres, but down Hangar Straight and from Stowe to Vale is a great place for some extra power if you have some left.	en	[]	[]	[]	0	0	1	[]	[]	https://twitter.com/GaryAndersonF1/status/1289533381072441345	False		0								[{'screen_name': 'JennieGow', 'name': 'Jennie Gow', 'id': '86740435'}]				
1289515741134217216	1289515741134217216	2020-08-01 16:28:05 IST	2020-08-01	16:28:05	+0530	1222156587055439872	garyandersonf1	Gary Anderson		I think Mercedes are either able to manage their ERS deployment better or have more energy left for the last sector of the lap. Others seem to use more of it in sector 1.	en	[]	[]	[]	3	4	49	[]	[]	https://twitter.com/GaryAndersonF1/status/1289515741134217216	False		0								[]				
1289510983778492417	1289510983778492417	2020-08-01 16:09:11 IST	2020-08-01	16:09:11	+0530	1222156587055439872	garyandersonf1	Gary Anderson		With the ambient and track temperature cooler than yesterday, teams will have been starting all over again at the start of this session. The grip levels will be much higher.	en	[]	[]	[]	1	3	31	[]	[]	https://twitter.com/GaryAndersonF1/status/1289510983778492417	False		0								[]				
1289509822816124929	1289509822816124929	2020-08-01 16:04:34 IST	2020-08-01	16:04:34	+0530	1222156587055439872	garyandersonf1	Gary Anderson		I don't understand why the Hulk hasn't been given more running time so far in these different conditions. He's done seven laps so far.	en	[]	[]	[]	5	1	37	[]	[]	https://twitter.com/GaryAndersonF1/status/1289509822816124929	False		0								[]				
1289509590887886848	1289509590887886848	2020-08-01 16:03:39 IST	2020-08-01	16:03:39	+0530	1222156587055439872	garyandersonf1	Gary Anderson		Red Bull's problems are putting extra pressure on Albon. He badly needed a few extra confidence-building laps.	en	[]	[]	[]	2	3	52	[]	[]	https://twitter.com/GaryAndersonF1/status/1289509590887886848	False		0								[]				
1289214833699598336	1289214833699598336	2020-07-31 20:32:23 IST	2020-07-31	20:32:23	+0530	1222156587055439872	garyandersonf1	Gary Anderson		Stroll 1:27.274s, Hulkenberg 1:27.910s - that's a 0.636s gap. Not bad for someone who didn't have a drive 24 hours ago.	en	[]	[]	[]	3	9	103	[]	[]	https://twitter.com/GaryAndersonF1/status/1289214833699598336	False		0								[]				
1289211950291968001	1289211950291968001	2020-07-31 20:20:56 IST	2020-07-31	20:20:56	+0530	1222156587055439872	garyandersonf1	Gary Anderson		And what we saw there is exactly what less understeer does...	en	[]	[]	[]	6	11	99	[]	[]	https://twitter.com/GaryAndersonF1/status/1289211950291968001	False		0								[]				
1289207534297821184	1289207534297821184	2020-07-31 20:03:23 IST	2020-07-31	20:03:23	+0530	1222156587055439872	garyandersonf1	Gary Anderson		Interesting that both Red Bull drivers have complained about low-speed understeer. Understeer will increase with the softer tyres, but if I was engineering their cars I would make sure not to dial it out. If they do, the nervous rear end will come back.	en	[]	[]	[]	4	8	93	[]	[]	https://twitter.com/GaryAndersonF1/status/1289207534297821184	False		0								[]				
1289143960166977539	1289143960166977539	2020-07-31 15:50:45 IST	2020-07-31	15:50:45	+0530	1222156587055439872	garyandersonf1	Gary Anderson		RT @eddstrawF1: The verdicts are in from @GaryAndersonF1, @SMitchellF1, @SportmphMark, @jackbenyon, @vkhorounzhiy and me on Nico Hulkenberg…	en	[{'screen_name': 'eddstrawf1', 'name': 'edd straw', 'id': '31401945'}, {'screen_name': 'garyandersonf1', 'name': 'gary anderson', 'id': '1222156587055439872'}, {'screen_name': 'smitchellf1', 'name': 'scott mitchell', 'id': '38485549'}, {'screen_name': 'sportmphmark', 'name': 'mark hughes', 'id': '1622716321'}, {'screen_name': 'jackbenyon', 'name': 'jack benyon', 'id': '239537056'}, {'screen_name': 'vkhorounzhiy', 'name': 'valentin khorounzhiy', 'id': '120470332'}]	[]	[]	0	4	0	[]	[]	https://twitter.com/GaryAndersonF1/status/1289143960166977539	False		0								[]				
1289142053344030720	1289142053344030720	2020-07-31 15:43:11 IST	2020-07-31	15:43:11	+0530	1222156587055439872	garyandersonf1	Gary Anderson		Nico Hulkenberg is choice from Racing Point. He is without doubt a top driver and with a little bit of luck he could get his first podium	en	[]	[]	[]	6	4	285	[]	[]	https://twitter.com/GaryAndersonF1/status/1289142053344030720	False		0								[]				
1286718999770824705	1286718999770824705	2020-07-24 23:14:50 IST	2020-07-24	23:14:50	+0530	1222156587055439872	garyandersonf1	Gary Anderson		Well done to whoever made this - it's just like the real one. It's my favourite F1 car as well, but then I am a bit biased...	en	[]	[]	[]	7	13	203	[]	[]	https://twitter.com/GaryAndersonF1/status/1286718999770824705	False	https://twitter.com/F1JordanGP/status/1286596440354099200	0								[]				
1285137629005185024	1285137629005185024	2020-07-20 14:31:02 IST	2020-07-20	14:31:02	+0530	1222156587055439872	garyandersonf1	Gary Anderson		Any suggestions for the opening question for the next episode of my podcast?   https://t.co/4FKdRZ1T7r	en	[]	['https://podcasts.apple.com/gb/podcast/the-gary-anderson-f1-show/id1502430647']	[]	24	2	15	[]	[]	https://twitter.com/GaryAndersonF1/status/1285137629005185024	False		0								[]				
