id	conversation_id	created_at	date	time	timezone	user_id	username	name	place	tweet	language	mentions	urls	photos	replies_count	retweets_count	likes_count	hashtags	cashtags	link	retweet	quote_url	video	thumbnail	near	geo	source	user_rt_id	user_rt	retweet_id	reply_to	retweet_date	translate	trans_src	trans_dest
1383768338728308736	1383768338728308736	2021-04-18 18:34:15 IST	2021-04-18	18:34:15	+0530	1222156587055439872	garyandersonf1	Gary Anderson		And that's confirmed, as I said, brake-by-wire problems for Aston Martin	en	[]	[]	[]	0	1	7	[]	[]	https://twitter.com/GaryAndersonF1/status/1383768338728308736	False		0								[]				
1383766378067283975	1383766378067283975	2021-04-18 18:26:28 IST	2021-04-18	18:26:28	+0530	1222156587055439872	garyandersonf1	Gary Anderson		Pretty sure that would be a rear brake-by-wire problem on the Aston Martin	en	[]	[]	[]	1	11	36	[]	[]	https://twitter.com/GaryAndersonF1/status/1383766378067283975	False		0								[]				
1376208349814005769	1376208349814005769	2021-03-28 21:53:33 IST	2021-03-28	21:53:33	+0530	1222156587055439872	garyandersonf1	Gary Anderson		It's going to be tough for Verstappen. Just not quick enough at the moment	en	[]	[]	[]	5	2	46	[]	[]	https://twitter.com/GaryAndersonF1/status/1376208349814005769	False		0								[]				
1376204526009606146	1376204526009606146	2021-03-28 21:38:22 IST	2021-03-28	21:38:22	+0530	1222156587055439872	garyandersonf1	Gary Anderson		Verstappen has to pit again to comply with the two tyre compound rules. Hamilton has complied so it's going to be a dogfight at the end of this race	en	[]	[]	[]	3	16	98	[]	[]	https://twitter.com/GaryAndersonF1/status/1376204526009606146	False		0								[]				
1376202395026350081	1376202395026350081	2021-03-28 21:29:54 IST	2021-03-28	21:29:54	+0530	1222156587055439872	garyandersonf1	Gary Anderson		That's how the pressure changes when you have close competition!	en	[]	[]	[]	8	13	98	[]	[]	https://twitter.com/GaryAndersonF1/status/1376202395026350081	False		0								[]				
1376201880129392645	1376201880129392645	2021-03-28 21:27:51 IST	2021-03-28	21:27:51	+0530	1222156587055439872	garyandersonf1	Gary Anderson		27 laps is a long way for Hamilton to the chequered flag on his second set of hards	en	[]	[]	[]	1	7	37	[]	[]	https://twitter.com/GaryAndersonF1/status/1376201880129392645	False		0								[]				
1376198569221353476	1376197156932059141	2021-03-28 21:14:42 IST	2021-03-28	21:14:42	+0530	1222156587055439872	garyandersonf1	Gary Anderson		Verstappen went medium-medium	nl	[]	[]	[]	0	0	6	[]	[]	https://twitter.com/GaryAndersonF1/status/1376198569221353476	False		0								[]				
1376197156932059141	1376197156932059141	2021-03-28 21:09:05 IST	2021-03-28	21:09:05	+0530	1222156587055439872	garyandersonf1	Gary Anderson		Max is on a two-stopper	en	[]	[]	[]	7	7	51	[]	[]	https://twitter.com/GaryAndersonF1/status/1376197156932059141	False		0								[]				
1375793316118286342	1375793316118286342	2021-03-27 18:24:22 IST	2021-03-27	18:24:22	+0530	1222156587055439872	garyandersonf1	Gary Anderson		Was that lap of Max's done on the sniff of an oily rag?	en	[]	[]	[]	4	3	61	[]	[]	https://twitter.com/GaryAndersonF1/status/1375793316118286342	False		0								[]				
1375788632154472448	1375788077549940749	2021-03-27 18:05:45 IST	2021-03-27	18:05:45	+0530	1222156587055439872	garyandersonf1	Gary Anderson		Which, in turn, reduces the drag.	en	[]	[]	[]	0	0	32	[]	[]	https://twitter.com/GaryAndersonF1/status/1375788632154472448	False		0								[]				
1375788077549940749	1375788077549940749	2021-03-27 18:03:33 IST	2021-03-27	18:03:33	+0530	1222156587055439872	garyandersonf1	Gary Anderson		The straightline speed difference between Mercedes and Red Bull is another outcome of Red Bull's high-rake concept. Basically, the Mercedes diffuser stalls earlier and more dramatically than the Red Bull version	en	[]	[]	[]	3	11	180	[]	[]	https://twitter.com/GaryAndersonF1/status/1375788077549940749	False		0								[]				
1375415537866510344	1375415537866510344	2021-03-26 17:23:12 IST	2021-03-26	17:23:12	+0530	1222156587055439872	garyandersonf1	Gary Anderson		Looked like a bit of front-tyre graining on Hamilton's car. That on the outer shoulder on both fronts would come from understeer in slow corners	en	[]	[]	[]	1	1	63	[]	[]	https://twitter.com/GaryAndersonF1/status/1375415537866510344	False		0								[]				
1375414008182882304	1375414008182882304	2021-03-26 17:17:08 IST	2021-03-26	17:17:08	+0530	1222156587055439872	garyandersonf1	Gary Anderson		Strange to see Hamilton using soft tyres and DRS seven minutes into the first session. That's not normal by Mercedes	en	[]	[]	[]	17	29	220	[]	[]	https://twitter.com/GaryAndersonF1/status/1375414008182882304	False		0								[]				
1370813570024357902	1370813570024357902	2021-03-14 00:36:38 IST	2021-03-14	00:36:38	+0530	1222156587055439872	garyandersonf1	Gary Anderson		It's always the good guys that go too early. Murray, you were F1 and always will be. Although they will try, they will never, ever find another you. RIP, my friend, we will miss you	en	[]	[]	[]	10	42	830	[]	[]	https://twitter.com/GaryAndersonF1/status/1370813570024357902	False		0								[]				
1370656922379108354	1370656922379108354	2021-03-13 14:14:10 IST	2021-03-13	14:14:10	+0530	1222156587055439872	garyandersonf1	Gary Anderson		Questions can be asked in the comments in this article   https://t.co/lAPvzzUOZN	en	[]	['https://the-race.com/formula-1/live-f1-tech-qa-with-gary-anderson-at-1-30pm-uk/']	[]	1	3	8	[]	[]	https://twitter.com/GaryAndersonF1/status/1370656922379108354	False		0								[]				
1370313703439134721	1370313703439134721	2021-03-12 15:30:20 IST	2021-03-12	15:30:20	+0530	1222156587055439872	garyandersonf1	Gary Anderson		RT @wearetherace: The early talk on the first day of #F1Testing has been #Alpine's unusual, bulbous airbox.  Gary Anderson gives his verdic…	en	[{'screen_name': 'wearetherace', 'name': 'the race', 'id': '1214181376536141830'}]	[]	[]	0	4	0	['f1testing', 'alpine']	[]	https://twitter.com/GaryAndersonF1/status/1370313703439134721	False		0								[]				
1370297521537495040	1370297521537495040	2021-03-12 14:26:02 IST	2021-03-12	14:26:02	+0530	1222156587055439872	garyandersonf1	Gary Anderson		My look at the Mercedes floor   https://t.co/3muW4r4aQE	en	[]	['https://the-race.com/formula-1/gary-anderson-explains-mercedes-dramatic-new-f1-floor/']	[]	2	6	36	[]	[]	https://twitter.com/GaryAndersonF1/status/1370297521537495040	False		0								[]				
1368182287225995265	1368182287225995265	2021-03-06 18:20:51 IST	2021-03-06	18:20:51	+0530	1222156587055439872	garyandersonf1	Gary Anderson		RT @wearetherace: 👀 #Williams has really gone to town with the first #F1 design of its Dorilton era says Gary Anderson, in his analysis of…	en	[{'screen_name': 'wearetherace', 'name': 'the race', 'id': '1214181376536141830'}]	[]	[]	0	6	0	['williams', 'f1']	[]	https://twitter.com/GaryAndersonF1/status/1368182287225995265	False		0								[]				
1368182259623297030	1368182259623297030	2021-03-06 18:20:44 IST	2021-03-06	18:20:44	+0530	1222156587055439872	garyandersonf1	Gary Anderson		RT @wearetherace: 🎙 LISTEN UP!   The first step in the #Williams team’s hoped-for revival under new ownership Dorilton Capital is examined…	en	[{'screen_name': 'wearetherace', 'name': 'the race', 'id': '1214181376536141830'}]	[]	[]	0	4	0	['williams']	[]	https://twitter.com/GaryAndersonF1/status/1368182259623297030	False		0								[]				
1366808055510401032	1366808055510401032	2021-03-02 23:20:09 IST	2021-03-02	23:20:09	+0530	1222156587055439872	garyandersonf1	Gary Anderson		The Mercedes launch had a technical director, two drivers, a team principal and a car. Just how it should be. Podcast here    https://t.co/b2pxmCBDrr	en	[]	['https://the-race.com/formula-1/podcast-the-lessons-from-mercedes-openly-secretive-f1-launch/']	[]	1	2	38	[]	[]	https://twitter.com/GaryAndersonF1/status/1366808055510401032	False		0								[]				
1359869711379558400	1359869711379558400	2021-02-11 19:49:39 IST	2021-02-11	19:49:39	+0530	1222156587055439872	garyandersonf1	Gary Anderson		RT @wearetherace: Ok fine. You WIN. We'll post a picture of the Jordan 191, which we rarely ever do.  https://t.co/q6eNV9tCvY  https://t.co/h…	en	[{'screen_name': 'wearetherace', 'name': 'the race', 'id': '1214181376536141830'}]	[]	[]	0	6	0	[]	[]	https://twitter.com/GaryAndersonF1/status/1359869711379558400	False	https://twitter.com/wearetherace/status/1359864622661124102	0								[]				
1359123436224851971	1359123436224851971	2021-02-09 18:24:13 IST	2021-02-09	18:24:13	+0530	1222156587055439872	garyandersonf1	Gary Anderson		If podcasts on YouTube are your thing, here's what I want to see each F1 team improve on in 2021 from The Race F1 Podcast   https://t.co/cMy2ecuUk9	en	[]	['https://www.youtube.com/watch?v=mM1FqbAwiW0&feature=youtu.be']	[]	0	2	8	[]	[]	https://twitter.com/GaryAndersonF1/status/1359123436224851971	False		0								[]				
1359089671272341505	1359089671272341505	2021-02-09 16:10:02 IST	2021-02-09	16:10:02	+0530	1222156587055439872	garyandersonf1	Gary Anderson		RT @wearetherace: Where each #F1 team needs to improve in 2021.  With car launches fast approaching, @SportmphMark, @GaryAndersonF1, @SMitc…	en	[{'screen_name': 'wearetherace', 'name': 'the race', 'id': '1214181376536141830'}, {'screen_name': 'sportmphmark', 'name': 'mark hughes', 'id': '1622716321'}, {'screen_name': 'garyandersonf1', 'name': 'gary anderson', 'id': '1222156587055439872'}]	[]	[]	0	10	0	['f1']	[]	https://twitter.com/GaryAndersonF1/status/1359089671272341505	False		0								[]				
1359089591739961344	1359089591739961344	2021-02-09 16:09:43 IST	2021-02-09	16:09:43	+0530	1222156587055439872	garyandersonf1	Gary Anderson		How F1 seat fittings work   https://t.co/dtwmbMqqTr	en	[]	['https://the-race.com/formula-1/what-actually-happens-at-an-f1-seat-fitting/']	[]	0	4	31	[]	[]	https://twitter.com/GaryAndersonF1/status/1359089591739961344	False		0								[]				
1356184112604831744	1356184112604831744	2021-02-01 15:44:23 IST	2021-02-01	15:44:23	+0530	1222156587055439872	garyandersonf1	Gary Anderson		On 2021 v 2022 car development   https://t.co/YHJO4yQN27	en	[]	['https://the-race.com/formula-1/gary-anderson-writing-off-2021-to-focus-on-2022-is-foolhardy/']	[]	4	12	67	[]	[]	https://twitter.com/GaryAndersonF1/status/1356184112604831744	False		0								[]				
1352612829908455424	1352612828281233408	2021-01-22 19:13:23 IST	2021-01-22	19:13:23	+0530	1222156587055439872	garyandersonf1	Gary Anderson		Four drivers went home by 9am on a Friday morning after pre-qualifying, 30 tried to qualify for 26 grid positions and you only got points to sixth place in the race. How times have changed - those 14 points we scored were like rocking horse sh1t (2/2)	en	[]	[]	[]	10	12	321	[]	[]	https://twitter.com/GaryAndersonF1/status/1352612829908455424	False		0								[]				
1352612828281233408	1352612828281233408	2021-01-22 19:13:23 IST	2021-01-22	19:13:23	+0530	1222156587055439872	garyandersonf1	Gary Anderson		The green Jordan 191 certainly looked good, but to say it was a flop is questionable. In defence of our achievements, we started the season with three people in the design team and 28 total staff. Remember, at that time 34 cars entered each race (1/2)    https://t.co/fmi2OnguKf	en	[]	['https://twitter.com/F1/status/1352300340104867840?s=20']	[]	28	35	475	[]	[]	https://twitter.com/GaryAndersonF1/status/1352612828281233408	False	https://twitter.com/F1/status/1352300340104867840?s=20	0								[]				
1352609971658235907	1352609971658235907	2021-01-22 19:02:02 IST	2021-01-22	19:02:02	+0530	1222156587055439872	garyandersonf1	Gary Anderson		RT @wearetherace: Want to ask @GaryAndersonF1 an #F1 related question? Well, now is your chance!   Get them in down in the comments and the…	en	[{'screen_name': 'wearetherace', 'name': 'the race', 'id': '1214181376536141830'}, {'screen_name': 'garyandersonf1', 'name': 'gary anderson', 'id': '1222156587055439872'}]	[]	[]	0	5	0	['f1']	[]	https://twitter.com/GaryAndersonF1/status/1352609971658235907	False		0								[]				
1341305712299954178	1341305712299954178	2020-12-22 14:22:56 IST	2020-12-22	14:22:56	+0530	1222156587055439872	garyandersonf1	Gary Anderson		My verdict on all 10 F1 teams in 2020   https://t.co/1NB6NXnNcb	en	[]	['https://the-race.com/formula-1/gary-anderson-podcast-judging-each-f1-team-in-2020/']	[]	3	0	25	[]	[]	https://twitter.com/GaryAndersonF1/status/1341305712299954178	False		0								[]				
1339163178358464512	1339163178358464512	2020-12-16 16:29:16 IST	2020-12-16	16:29:16	+0530	1222156587055439872	garyandersonf1	Gary Anderson		My verdict on the 10 F1 teams in 2020   https://t.co/1NB6NXnNcb	en	[]	['https://the-race.com/formula-1/gary-anderson-podcast-judging-each-f1-team-in-2020/']	[]	0	3	26	[]	[]	https://twitter.com/GaryAndersonF1/status/1339163178358464512	False		0								[]				
1338133752313163777	1338133752313163777	2020-12-13 20:18:42 IST	2020-12-13	20:18:42	+0530	1222156587055439872	garyandersonf1	Gary Anderson		The final curtain (chequered) is just around the corner	en	[]	[]	[]	1	2	22	[]	[]	https://twitter.com/GaryAndersonF1/status/1338133752313163777	False		0								[]				
1338128274317316098	1338128274317316098	2020-12-13 19:56:56 IST	2020-12-13	19:56:56	+0530	1222156587055439872	garyandersonf1	Gary Anderson		Lap 40 - 3rd McLaren 202, 4th Racing Point 196, 5th Renault 178.	en	[]	[]	[]	2	6	23	[]	[]	https://twitter.com/GaryAndersonF1/status/1338128274317316098	False		0								[]				
1338124498323857412	1338124498323857412	2020-12-13 19:41:56 IST	2020-12-13	19:41:56	+0530	1222156587055439872	garyandersonf1	Gary Anderson		3rd McLaren 198, 4th Racing Point 195, 5th Renault 182...	en	[]	[]	[]	3	3	35	[]	[]	https://twitter.com/GaryAndersonF1/status/1338124498323857412	False		0								[]				
1338122786578030594	1338122786578030594	2020-12-13 19:35:08 IST	2020-12-13	19:35:08	+0530	1222156587055439872	garyandersonf1	Gary Anderson		Wasn't the Sakhir GP a great race?	en	[]	[]	[]	31	15	728	[]	[]	https://twitter.com/GaryAndersonF1/status/1338122786578030594	False		0								[]				
1338109099612004352	1338109099612004352	2020-12-13 18:40:44 IST	2020-12-13	18:40:44	+0530	1222156587055439872	garyandersonf1	Gary Anderson		Norris is the first guy on the grid on soft tyres. he could be the guy to watch off the start line	en	[]	[]	[]	0	11	81	[]	[]	https://twitter.com/GaryAndersonF1/status/1338109099612004352	False		0								[]				
1337701503012921347	1337701503012921347	2020-12-12 15:41:06 IST	2020-12-12	15:41:06	+0530	1222156587055439872	garyandersonf1	Gary Anderson		Whilst Sky Sports F1 are fitting there back-slapping machine, I think a special thanks should go out to all those wives, partners and kids of all those people who go racing. It hasn't been a walk in the park for them either.	en	[]	[]	[]	12	22	952	[]	[]	https://twitter.com/GaryAndersonF1/status/1337701503012921347	False		0								[]				
1337697298575482880	1337697298575482880	2020-12-12 15:24:23 IST	2020-12-12	15:24:23	+0530	1222156587055439872	garyandersonf1	Gary Anderson		Oh, to hear that screaming V10!   https://t.co/gxkuXT0vYv	en	[]	['https://the-race.com/formula-1/f1-2005-vs-f1-2020-what-we-learned-from-renaults-r25-demo/']	[]	8	0	33	[]	[]	https://twitter.com/GaryAndersonF1/status/1337697298575482880	False		0								[]				
1337335031359021057	1337335031359021057	2020-12-11 15:24:52 IST	2020-12-11	15:24:52	+0530	1222156587055439872	garyandersonf1	Gary Anderson		Hamilton's gloves look different. Is that a reaction to Grosjean's hand burns?	en	[]	[]	[]	0	2	44	[]	[]	https://twitter.com/GaryAndersonF1/status/1337335031359021057	False		0								[]				
1337331102780887040	1337331102780887040	2020-12-11 15:09:15 IST	2020-12-11	15:09:15	+0530	1222156587055439872	garyandersonf1	Gary Anderson		On Hamilton's car, something is probably stopping the front brake master cylinder from coming fully back. This will keep pressure on the front calipers. Mods for Russell has probably contributed to this problem.	en	[]	[]	[]	2	4	95	[]	[]	https://twitter.com/GaryAndersonF1/status/1337331102780887040	False		0								[]				
1337100024824664064	1337100024824664064	2020-12-10 23:51:02 IST	2020-12-10	23:51:02	+0530	1222156587055439872	garyandersonf1	Gary Anderson		Will Russell be able to take some of what he learned last weekend on how Mercedes operate back to Williams this weekend? They use the same Mercedes engine,so things like harvesting and  deployment can make a big difference. Perhaps forget about how they go about the pitstops...	en	[]	[]	[]	3	3	179	[]	[]	https://twitter.com/GaryAndersonF1/status/1337100024824664064	False		0								[]				
1336319035496009736	1336319035496009736	2020-12-08 20:07:40 IST	2020-12-08	20:07:40	+0530	1222156587055439872	garyandersonf1	Gary Anderson		Still open for questions for the next episode of my podcast. Something technical you would like explained? Something about the Sakhir GP or the final race of the season in Skahir?	en	[]	[]	[]	29	2	19	[]	[]	https://twitter.com/GaryAndersonF1/status/1336319035496009736	False		0								[]				
1336296130292969472	1336296130292969472	2020-12-08 18:36:39 IST	2020-12-08	18:36:39	+0530	1222156587055439872	garyandersonf1	Gary Anderson		Any questions for the next episode of my podcast? Here's last week's in case you missed it.   https://t.co/GjBc3XQ22I	en	[]	['https://the-race.com/formula-1/gary-anderson-podcast-on-grosjeans-crash-and-f1-stand-ins/']	[]	6	2	11	[]	[]	https://twitter.com/GaryAndersonF1/status/1336296130292969472	False		0								[]				
1335656637277876227	1335656637277876227	2020-12-07 00:15:32 IST	2020-12-07	00:15:32	+0530	1222156587055439872	garyandersonf1	Gary Anderson		Well done you guys at Silverstone!	en	[]	[]	[]	0	3	64	[]	[]	https://twitter.com/GaryAndersonF1/status/1335656637277876227	False		0								[]				
1335655802879741954	1335655802879741954	2020-12-07 00:12:13 IST	2020-12-07	00:12:13	+0530	1222156587055439872	garyandersonf1	Gary Anderson		I love it when the underdog gets one over the big boys, especially when the big boys trip over themselves by trying to be too clever. But sorry for Russell - not his fault in any way.	en	[]	[]	[]	5	18	208	[]	[]	https://twitter.com/GaryAndersonF1/status/1335655802879741954	False		0								[]				
1335650754602938368	1335650754602938368	2020-12-06 23:52:09 IST	2020-12-06	23:52:09	+0530	1222156587055439872	garyandersonf1	Gary Anderson		Did Mercedes really win seven world championships in a row?	en	[]	[]	[]	10	6	104	[]	[]	https://twitter.com/GaryAndersonF1/status/1335650754602938368	False		0								[]				
1335650023594471427	1335650023594471427	2020-12-06 23:49:15 IST	2020-12-06	23:49:15	+0530	1222156587055439872	garyandersonf1	Gary Anderson		Mercedes, what can I say......	en	[]	[]	[]	14	5	142	[]	[]	https://twitter.com/GaryAndersonF1/status/1335650023594471427	False		0								[]				
1335648220748394497	1335648220748394497	2020-12-06 23:42:05 IST	2020-12-06	23:42:05	+0530	1222156587055439872	garyandersonf1	Gary Anderson		Is this the right time to ask that controversial question once again? Is it the car or the driver???	en	[]	[]	[]	43	8	115	[]	[]	https://twitter.com/GaryAndersonF1/status/1335648220748394497	False		0								[]				
1335646219062943744	1335646219062943744	2020-12-06 23:34:08 IST	2020-12-06	23:34:08	+0530	1222156587055439872	garyandersonf1	Gary Anderson		Equal treatment!	en	[]	[]	[]	1	1	36	[]	[]	https://twitter.com/GaryAndersonF1/status/1335646219062943744	False		0								[]				
1335645823351336963	1335645823351336963	2020-12-06 23:32:34 IST	2020-12-06	23:32:34	+0530	1222156587055439872	garyandersonf1	Gary Anderson		Looking at Stroll, I think Mercedes could have stopped and fitted softs to the end of the race and one stopped. For that, they would have fitted 3-lap qualifying used tyres as they will have had a heat treatment. But they went for the safe option with hards.	en	[]	[]	[]	1	1	27	[]	[]	https://twitter.com/GaryAndersonF1/status/1335645823351336963	False		0								[]				
1335634604259217417	1335634604259217417	2020-12-06 22:47:59 IST	2020-12-06	22:47:59	+0530	1222156587055439872	garyandersonf1	Gary Anderson		Ambitious from Leclerc	en	[]	[]	[]	10	1	48	[]	[]	https://twitter.com/GaryAndersonF1/status/1335634604259217417	False		0								[]				
1335620012678189057	1335620012678189057	2020-12-06 21:50:00 IST	2020-12-06	21:50:00	+0530	1222156587055439872	garyandersonf1	Gary Anderson		Last weekend's Bahrain GP was 57 laps. It had 15 numbered corners, a total race distance of 308km and 855 corners. The Sakhir GP is 87 laps with 11 numbered corners and a total race distance of 308km and 957 corners - so the same distance with actually more corners	en	[]	[]	[]	1	22	125	[]	[]	https://twitter.com/GaryAndersonF1/status/1335620012678189057	False		0								[]				
1335611929784676362	1335611929784676362	2020-12-06 21:17:53 IST	2020-12-06	21:17:53	+0530	1222156587055439872	garyandersonf1	Gary Anderson		Tip of the day: in the old days at Zandvoort, to protect the engine from sand ingestion we taped a greased stocking into the airbox with a pull-cord string beside the driver's head. After a few laps, when the shenanigans finished, the driver would pull it out and get rid of it	en	[]	[]	[]	9	10	254	[]	[]	https://twitter.com/GaryAndersonF1/status/1335611929784676362	False		0								[]				
1335564485474521089	1335564485474521089	2020-12-06 18:09:21 IST	2020-12-06	18:09:21	+0530	1222156587055439872	garyandersonf1	Gary Anderson		Sand racing in Bahrain for the F2 boys!	en	[]	[]	[]	0	1	27	[]	[]	https://twitter.com/GaryAndersonF1/status/1335564485474521089	False		0								[]				
1335545591334625282	1335545590130876417	2020-12-06 16:54:16 IST	2020-12-06	16:54:16	+0530	1222156587055439872	garyandersonf1	Gary Anderson		...it's dark, raining, foggy and windy and you're in a hurry. Imagine trying to come to terms with all the switches etc. If you multiply that by 100, then that's just an example of his problems for the race today (2/2)	en	[]	[]	[]	5	4	96	[]	[]	https://twitter.com/GaryAndersonF1/status/1335545591334625282	False		0								[]				
1335545590130876417	1335545590130876417	2020-12-06 16:54:16 IST	2020-12-06	16:54:16	+0530	1222156587055439872	garyandersonf1	Gary Anderson		As an example of what George Russell has been up against this weekend, just think how you would feel if you'd just flown into a strange airport in a place where they drive on the opposite side of the road, got your rental car, which is a car you had never sat in... (1/2)	en	[]	[]	[]	7	7	104	[]	[]	https://twitter.com/GaryAndersonF1/status/1335545590130876417	False		0								[]				
1335277057660563459	1335277057660563459	2020-12-05 23:07:13 IST	2020-12-05	23:07:13	+0530	1222156587055439872	garyandersonf1	Gary Anderson		Vettel not fast enough on mediums. Will probably go on softs for last run.	en	[]	[]	[]	2	3	18	[]	[]	https://twitter.com/GaryAndersonF1/status/1335277057660563459	False		0								[]				
1335273885370101761	1335273885370101761	2020-12-05 22:54:37 IST	2020-12-05	22:54:37	+0530	1222156587055439872	garyandersonf1	Gary Anderson		In Q1, tenth was only 0.4 seconds off fastest. Who is brave enough to try to get into that top 10 on mediums?	en	[]	[]	[]	1	5	44	[]	[]	https://twitter.com/GaryAndersonF1/status/1335273885370101761	False		0								[]				
1335270123918209024	1335270123918209024	2020-12-05 22:39:40 IST	2020-12-05	22:39:40	+0530	1222156587055439872	garyandersonf1	Gary Anderson		I think everyone is saving their soft tyres for when it really matters in Q2 and/or Q3. Might need them if they get caught in traffic	en	[]	[]	[]	1	4	29	[]	[]	https://twitter.com/GaryAndersonF1/status/1335270123918209024	False		0								[]				
1334936406934876166	1334936406934876166	2020-12-05 00:33:35 IST	2020-12-05	00:33:35	+0530	1222156587055439872	garyandersonf1	Gary Anderson		Is it a bird? Is it a plane? No, it's George Russell in Lewis Hamilton's Mercedes, fastest in both sessions. Lewis will be happy...not!	en	[]	[]	[]	16	3	129	[]	[]	https://twitter.com/GaryAndersonF1/status/1334936406934876166	False		0								[]				
1334934986827444225	1334934986827444225	2020-12-05 00:27:57 IST	2020-12-05	00:27:57	+0530	1222156587055439872	garyandersonf1	Gary Anderson		If Russell does have some car-fit problems, he needs to be careful not to trap a nerve or pull a muscle. Leave his long runs until Sunday, by that time I'm sure he will be a bit better sorted	en	[]	[]	[]	0	3	56	[]	[]	https://twitter.com/GaryAndersonF1/status/1334934986827444225	False		0								[]				
1334932429606359040	1334932429606359040	2020-12-05 00:17:47 IST	2020-12-05	00:17:47	+0530	1222156587055439872	garyandersonf1	Gary Anderson		In the end, it will be the driver that does the fastest complete lap time that is on pole. Fastest sector times mean nothing, unless all done on the same lap	en	[]	[]	[]	1	3	137	[]	[]	https://twitter.com/GaryAndersonF1/status/1334932429606359040	False		0								[]				
1334926991846481922	1334926991846481922	2020-12-04 23:56:11 IST	2020-12-04	23:56:11	+0530	1222156587055439872	garyandersonf1	Gary Anderson		The mechanics are changing the weight distribution by altering the weight block that is in the front wing on Russell's car	en	[]	[]	[]	0	2	32	[]	[]	https://twitter.com/GaryAndersonF1/status/1334926991846481922	False		0								[]				
1334926633338286085	1334926633338286085	2020-12-04 23:54:45 IST	2020-12-04	23:54:45	+0530	1222156587055439872	garyandersonf1	Gary Anderson		That's a similar problem to when Verstappen was complaining about with the car bouncing. The tyre grips and lets go and affects the rear ride height through the amount of anti-squat built into the rear suspension geometry. I used to call it axle tramp in my old Ford Anglia.....	en	[]	[]	[]	0	2	35	[]	[]	https://twitter.com/GaryAndersonF1/status/1334926633338286085	False		0								[]				
