id	conversation_id	created_at	date	time	timezone	user_id	username	name	place	tweet	language	mentions	urls	photos	replies_count	retweets_count	likes_count	hashtags	cashtags	link	retweet	quote_url	video	thumbnail	near	geo	source	user_rt_id	user_rt	retweet_id	reply_to	retweet_date	translate	trans_src	trans_dest
1446806202634096642	1446806202634096642	2021-10-09 17:24:13 IST	2021-10-09	17:24:13	+0530	1222156587055439872	garyandersonf1	Gary Anderson		Perez doesn't need to qualify too far up front. As long as he, Gasly and, if possible, Tsunoda qualify in the top 10 they can all do their bit to delay Hamilton coming through. By contrast, Verstappen must qualify in front of Bottas and be on pole if possible	en	[]	[]	[]	9	3	117	[]	[]	https://twitter.com/GaryAndersonF1/status/1446806202634096642	False		0								[]				
1446775065408942087	1446775065408942087	2021-10-09 15:20:30 IST	2021-10-09	15:20:30	+0530	1222156587055439872	garyandersonf1	Gary Anderson		Feedback, feedback, feedback. Well done to Lando and his engineer	en	[]	[]	[]	0	0	20	[]	[]	https://twitter.com/GaryAndersonF1/status/1446775065408942087	False		0								[]				
1446774601757954050	1446774601757954050	2021-10-09 15:18:39 IST	2021-10-09	15:18:39	+0530	1222156587055439872	garyandersonf1	Gary Anderson		If you compare the wake coming off the Red Bull and Aston Martin front wing trailing edge, they are very different in their intensity and direction	en	[]	[]	[]	1	6	69	[]	[]	https://twitter.com/GaryAndersonF1/status/1446774601757954050	False		0								[]				
1446768052842946562	1446768052842946562	2021-10-09 14:52:38 IST	2021-10-09	14:52:38	+0530	1222156587055439872	garyandersonf1	Gary Anderson		McLaren and Lando will be working on trying to understand the crossover point for wets to inters and inters to dry tyres	en	[]	[]	[]	0	6	47	[]	[]	https://twitter.com/GaryAndersonF1/status/1446768052842946562	False		0								[]				
1446766740428427265	1446766740428427265	2021-10-09 14:47:25 IST	2021-10-09	14:47:25	+0530	1222156587055439872	garyandersonf1	Gary Anderson		This is the sort of situation where Lando and his engineer need to practice communication in these conditions and put it to bed for the future	en	[]	[]	[]	2	6	189	[]	[]	https://twitter.com/GaryAndersonF1/status/1446766740428427265	False		0								[]				
1446765877215563778	1446765877215563778	2021-10-09 14:43:59 IST	2021-10-09	14:43:59	+0530	1222156587055439872	garyandersonf1	Gary Anderson		The wet conditions are always a good time to have a look at how the car affects the off-surface airflow. Also, you can see why the drivers complain so much about turbulence following another car	en	[]	[]	[]	1	6	62	[]	[]	https://twitter.com/GaryAndersonF1/status/1446765877215563778	False		0								[]				
1446464726641356800	1446464726641356800	2021-10-08 18:47:19 IST	2021-10-08	18:47:19	+0530	1222156587055439872	garyandersonf1	Gary Anderson		By the time the car has spun and is going backwards, it will have lost a lot of speed so any lift generated would be minimal. This is more of a problem with indycars travelling sideways or backwards at a track like Indy, where the speed is still very high when the car rotates	en	[]	[]	[]	3	4	61	[]	[]	https://twitter.com/GaryAndersonF1/status/1446464726641356800	False	https://twitter.com/tadman_steve/status/1446458930297704467	0								[]				
1446449066032910339	1446449066032910339	2021-10-08 17:45:05 IST	2021-10-08	17:45:05	+0530	1222156587055439872	garyandersonf1	Gary Anderson		With the track offering a lot more grip than last year and softer tyres, the teams that based there set up on last year’s data will need to stiffen their set-up to react to the increased loads	en	[]	[]	[]	1	7	68	[]	[]	https://twitter.com/GaryAndersonF1/status/1446449066032910339	False		0								[]				
1446446265592594440	1446446265592594440	2021-10-08 17:33:58 IST	2021-10-08	17:33:58	+0530	1222156587055439872	garyandersonf1	Gary Anderson		Stacking up before last turn and it's only FP2...	en	[]	[]	[]	1	1	30	[]	[]	https://twitter.com/GaryAndersonF1/status/1446446265592594440	False		0								[]				
1442119874017431556	1442119874017431556	2021-09-26 19:02:25 IST	2021-09-26	19:02:25	+0530	1222156587055439872	garyandersonf1	Gary Anderson		Driver of the day for me is easily Norris.	en	[]	[]	[]	17	15	365	[]	[]	https://twitter.com/GaryAndersonF1/status/1442119874017431556	False		0								[]				
1442108897230217216	1442108897230217216	2021-09-26 18:18:48 IST	2021-09-26	18:18:48	+0530	1222156587055439872	garyandersonf1	Gary Anderson		Pit now and Norris would be 5s in front of Sainz, Hamilton just in front of Russell	en	[]	[]	[]	0	3	21	[]	[]	https://twitter.com/GaryAndersonF1/status/1442108897230217216	False		0								[]				
1442106307218219009	1442106307218219009	2021-09-26 18:08:31 IST	2021-09-26	18:08:31	+0530	1222156587055439872	garyandersonf1	Gary Anderson		Ricciardo is doing a good job for Norris, but losing places himself. Pit now and he will come out behind Russell	en	[]	[]	[]	1	14	74	[]	[]	https://twitter.com/GaryAndersonF1/status/1442106307218219009	False		0								[]				
1442104589436735489	1442104589436735489	2021-09-26 18:01:41 IST	2021-09-26	18:01:41	+0530	1222156587055439872	garyandersonf1	Gary Anderson		Norris is OK for now. McLaren should pit Ricciardo first	en	[]	[]	[]	1	3	58	[]	[]	https://twitter.com/GaryAndersonF1/status/1442104589436735489	False		0								[]				
1442096974153633794	1442096974153633794	2021-09-26 17:31:26 IST	2021-09-26	17:31:26	+0530	1222156587055439872	garyandersonf1	Gary Anderson		Front row ex-teammates, second row future teammates. Is this when we see the elbows out?	en	[]	[]	[]	1	4	66	[]	[]	https://twitter.com/GaryAndersonF1/status/1442096974153633794	False		0								[]				
1441751035962347523	1441751035962347523	2021-09-25 18:36:48 IST	2021-09-25	18:36:48	+0530	1222156587055439872	garyandersonf1	Gary Anderson		That wasn't a bad strategy, was it?	en	[]	[]	[]	4	6	214	[]	[]	https://twitter.com/GaryAndersonF1/status/1441751035962347523	False		0								[]				
1441749836248793094	1441749836248793094	2021-09-25 18:32:02 IST	2021-09-25	18:32:02	+0530	1222156587055439872	garyandersonf1	Gary Anderson		Nearly...	en	[]	[]	[]	0	0	24	[]	[]	https://twitter.com/GaryAndersonF1/status/1441749836248793094	False		0								[]				
1441748234070736910	1441748234070736910	2021-09-25 18:25:40 IST	2021-09-25	18:25:40	+0530	1222156587055439872	garyandersonf1	Gary Anderson		He has got to hang on for that last lap. It's the one that will count	en	[]	[]	[]	0	1	27	[]	[]	https://twitter.com/GaryAndersonF1/status/1441748234070736910	False		0								[]				
1441747075419590660	1441747075419590660	2021-09-25 18:21:03 IST	2021-09-25	18:21:03	+0530	1222156587055439872	garyandersonf1	Gary Anderson		Sky seem to agree!	en	[]	[]	[]	2	0	25	[]	[]	https://twitter.com/GaryAndersonF1/status/1441747075419590660	False		0								[]				
1441745899152052225	1441745899152052225	2021-09-25 18:16:23 IST	2021-09-25	18:16:23	+0530	1222156587055439872	garyandersonf1	Gary Anderson		If I was at Williams, I would gamble on Russell on slicks.  Not immediately, but go out with about 6 minutes to go	en	[]	[]	[]	20	11	335	[]	[]	https://twitter.com/GaryAndersonF1/status/1441745899152052225	False		0								[]				
1441745219385389075	1441745219385389075	2021-09-25 18:13:41 IST	2021-09-25	18:13:41	+0530	1222156587055439872	garyandersonf1	Gary Anderson		Who's going for slicks in Q3?	en	[]	[]	[]	10	3	67	[]	[]	https://twitter.com/GaryAndersonF1/status/1441745219385389075	False		0								[]				
1437060156702003200	1437060156702003200	2021-09-12 19:56:55 IST	2021-09-12	19:56:55	+0530	1222156587055439872	garyandersonf1	Gary Anderson		Ricciardo and Norris both need to drink from the boot on the podium!	en	[]	[]	[]	1	25	206	[]	[]	https://twitter.com/GaryAndersonF1/status/1437060156702003200	False		0								[]				
1437059992041963520	1437059992041963520	2021-09-12 19:56:16 IST	2021-09-12	19:56:16	+0530	1222156587055439872	garyandersonf1	Gary Anderson		Well done to McLaren - team and both drivers exceptional. But a really big congratulations to my old work colleague and McLaren technical director James Key	en	[]	[]	[]	1	26	503	[]	[]	https://twitter.com/GaryAndersonF1/status/1437059992041963520	False		0								[]				
1437050557122940928	1437050557122940928	2021-09-12 19:18:46 IST	2021-09-12	19:18:46	+0530	1222156587055439872	garyandersonf1	Gary Anderson		Not a good example for young drivers. Both Hamilton and Verstappen could have got out of that without incident	en	[]	[]	[]	34	34	302	[]	[]	https://twitter.com/GaryAndersonF1/status/1437050557122940928	False		0								[]				
1437042661173698565	1437042661173698565	2021-09-12 18:47:24 IST	2021-09-12	18:47:24	+0530	1222156587055439872	garyandersonf1	Gary Anderson		Different story to the sprint race. Norris needs to back Hamilton up just that little bit each lap to help team-mate Ricciardo get a decent gap to Hamilton	en	[]	[]	[]	2	3	67	[]	[]	https://twitter.com/GaryAndersonF1/status/1437042661173698565	False		0								[]				
1437037018987499520	1437037018987499520	2021-09-12 18:24:58 IST	2021-09-12	18:24:58	+0530	1222156587055439872	garyandersonf1	Gary Anderson		Wonder how those floor modifications on the Red Bull help the driver's clutch control off the start? I'll think about that and get back to you...	en	[]	[]	[]	2	3	90	[]	[]	https://twitter.com/GaryAndersonF1/status/1437037018987499520	False		0								[]				
1436702921282969608	1436702921282969608	2021-09-11 20:17:23 IST	2021-09-11	20:17:23	+0530	1222156587055439872	garyandersonf1	Gary Anderson		Ricciardo either needs to back off a little or Norris push so Norris can get the benefit of the DRS to help fight off Hamilton	en	[]	[]	[]	7	3	66	[]	[]	https://twitter.com/GaryAndersonF1/status/1436702921282969608	False		0								[]				
1436694862271860741	1436694862271860741	2021-09-11 19:45:22 IST	2021-09-11	19:45:22	+0530	1222156587055439872	garyandersonf1	Gary Anderson		The mechanics will start the car up every now and again. This is just to move and mix the fan and dry ice cooled fluids with the hot fluids within the engine	en	[]	[]	[]	1	4	79	[]	[]	https://twitter.com/GaryAndersonF1/status/1436694862271860741	False		0								[]				
1436645251905724428	1436645251905724428	2021-09-11 16:28:14 IST	2021-09-11	16:28:14	+0530	1222156587055439872	garyandersonf1	Gary Anderson		With Ferrari's performance so far this weekend, it looks like the sharp knives might be out in Maranello on Monday	en	[]	[]	[]	7	15	78	[]	[]	https://twitter.com/GaryAndersonF1/status/1436645251905724428	False		0								[]				
1436643912953782275	1436643912953782275	2021-09-11 16:22:55 IST	2021-09-11	16:22:55	+0530	1222156587055439872	garyandersonf1	Gary Anderson		You know we normally have no idea what fuel loads drivers are using? Well, FP2 on a sprint weekend is even more confusing	en	[]	[]	[]	4	4	77	[]	[]	https://twitter.com/GaryAndersonF1/status/1436643912953782275	False		0								[]				
1436642355478769665	1436642355478769665	2021-09-11 16:16:43 IST	2021-09-11	16:16:43	+0530	1222156587055439872	garyandersonf1	Gary Anderson		It's not the movement of the head that hurts in a crash, it's if it has a sudden stop. The HANS device attaches to the helmets with 45deg weave straps. These are very good at decelerating the helmet inertia before it hits anything	en	[]	[]	[]	1	11	87	[]	[]	https://twitter.com/GaryAndersonF1/status/1436642355478769665	False		0								[]				
1436638824797454340	1436638824797454340	2021-09-11 16:02:41 IST	2021-09-11	16:02:41	+0530	1222156587055439872	garyandersonf1	Gary Anderson		Whoops, that's the last thing you need with the sprint race just a few hours away. I used to hate morning warm-ups because there was nothing to gain and a lot to lose I your driver made a mistake	en	[]	[]	[]	4	8	162	[]	[]	https://twitter.com/GaryAndersonF1/status/1436638824797454340	False		0								[]				
1436633946452893698	1436633946452893698	2021-09-11 15:43:18 IST	2021-09-11	15:43:18	+0530	1222156587055439872	garyandersonf1	Gary Anderson		Exciting, isn't it?	en	[]	[]	[]	5	0	42	[]	[]	https://twitter.com/GaryAndersonF1/status/1436633946452893698	False		0								[]				
1436368661518950403	1436368661518950403	2021-09-10 22:09:10 IST	2021-09-10	22:09:10	+0530	1222156587055439872	garyandersonf1	Gary Anderson		Just waiting for them to trip over each other at the entry to Alboreto (now the name of the last turn)	en	[]	[]	[]	1	3	58	[]	[]	https://twitter.com/GaryAndersonF1/status/1436368661518950403	False		0								[]				
1436366836006858756	1436366836006858756	2021-09-10 22:01:54 IST	2021-09-10	22:01:54	+0530	1222156587055439872	garyandersonf1	Gary Anderson		It's so easy to fix this car 'parking' problem in qualifying and I just don't comprehend why the FIA doesn't do it. Simply set a maximum sector time by adding a set percentage to the average sector times, with the exact percentage allowed adjusted to suit each track	en	[]	[]	[]	5	16	109	[]	[]	https://twitter.com/GaryAndersonF1/status/1436366836006858756	False		0								[]				
1436362383086264322	1436362383086264322	2021-09-10 21:44:13 IST	2021-09-10	21:44:13	+0530	1222156587055439872	garyandersonf1	Gary Anderson		I have written about this problem of cars pootling around in qualifying many times. Nothing has been done. Do we have to wait for a car flying into the grandstands before the FIA realises the level of danger?	en	[]	[]	[]	30	53	505	[]	[]	https://twitter.com/GaryAndersonF1/status/1436362383086264322	False		0								[]				
1436318208986951682	1436318208986951682	2021-09-10 18:48:41 IST	2021-09-10	18:48:41	+0530	1222156587055439872	garyandersonf1	Gary Anderson		The Mercedes rear wing, being parallel, will have a bigger speed differential between the closed and open DRS function than the Red Bull	en	[]	[]	[]	2	18	190	[]	[]	https://twitter.com/GaryAndersonF1/status/1436318208986951682	False		0								[]				
1435163693420056582	1435163693420056582	2021-09-07 14:21:03 IST	2021-09-07	14:21:03	+0530	1222156587055439872	garyandersonf1	Gary Anderson		RT @wearetherace: We did a bonus episode of The Race #F1 Podcast yesterday, talking all things about the Bottas news and asking whether he…	en	[{'screen_name': 'wearetherace', 'name': 'the race', 'id': '1214181376536141830'}]	[]	[]	0	5	0	['f1']	[]	https://twitter.com/GaryAndersonF1/status/1435163693420056582	False		0								[]				
1434954437542432768	1434954437542432768	2021-09-07 00:29:32 IST	2021-09-07	00:29:32	+0530	1222156587055439872	garyandersonf1	Gary Anderson		Had a chat about @ValtteriBottas's Alfa Romeo move   https://t.co/RvINjlX1LM	en	[{'screen_name': 'valtteribottas', 'name': 'valtteri bottas', 'id': '1143472657'}]	['https://the-race.com/formula-1/f1-podcast-should-bottas-have-picked-williams-over-alfa/']	[]	4	0	20	[]	[]	https://twitter.com/GaryAndersonF1/status/1434954437542432768	False		0								[]				
1434527130604408837	1434527130604408837	2021-09-05 20:11:34 IST	2021-09-05	20:11:34	+0530	1222156587055439872	garyandersonf1	Gary Anderson		Amazed. No red flags, no safety cars, no virtual safety cars, minimal yellows. Who would have thought that?	en	[]	[]	[]	44	111	2047	[]	[]	https://twitter.com/GaryAndersonF1/status/1434527130604408837	False		0								[]				
1434517974623440901	1434517974623440901	2021-09-05 19:35:11 IST	2021-09-05	19:35:11	+0530	1222156587055439872	garyandersonf1	Gary Anderson		Do you think Lewis is trying to say you guys screwed up?	en	[]	[]	[]	13	0	84	[]	[]	https://twitter.com/GaryAndersonF1/status/1434517974623440901	False		0								[]				
1434502344440434692	1434502344440434692	2021-09-05 18:33:05 IST	2021-09-05	18:33:05	+0530	1222156587055439872	garyandersonf1	Gary Anderson		If anyone tries to be brave and goes down the inside in T3, it will end up a disaster	en	[]	[]	[]	1	5	38	[]	[]	https://twitter.com/GaryAndersonF1/status/1434502344440434692	False		0								[]				
1434494235936428032	1434494235936428032	2021-09-05 18:00:52 IST	2021-09-05	18:00:52	+0530	1222156587055439872	garyandersonf1	Gary Anderson		So, would Red Bull be devious enough to pit Perez at the end of lap 2, fit new softs and get out just in front of Max to allow him to use the DRS for a couple of laps to fight off Lewis? Just a thought...	en	[]	[]	[]	24	24	258	[]	[]	https://twitter.com/GaryAndersonF1/status/1434494235936428032	False		0								[]				
1434152078075695104	1434152078075695104	2021-09-04 19:21:15 IST	2021-09-04	19:21:15	+0530	1222156587055439872	garyandersonf1	Gary Anderson		Both Williams in the barriers going into right-hand corners, so probably wind affected. As Williams have said, their car is difficult in these conditions	en	[]	[]	[]	5	8	139	[]	[]	https://twitter.com/GaryAndersonF1/status/1434152078075695104	False		0								[]				
1434139514973392901	1434139514973392901	2021-09-04 18:31:20 IST	2021-09-04	18:31:20	+0530	1222156587055439872	garyandersonf1	Gary Anderson		I was at Zandvoort in 1977 with McLaren when Mario Andretti and James Hunt had their famous coming together at Turn 1. It dislodged the radiator on James's car and he spun on his own water	en	[]	[]	[]	2	10	142	[]	[]	https://twitter.com/GaryAndersonF1/status/1434139514973392901	False		0								[]				
1434107382594998273	1434107382594998273	2021-09-04 16:23:39 IST	2021-09-04	16:23:39	+0530	1222156587055439872	garyandersonf1	Gary Anderson		I think Kubica needs a pat on the back. A great job from limited running	en	[]	[]	[]	9	60	1393	[]	[]	https://twitter.com/GaryAndersonF1/status/1434107382594998273	False		0								[]				
1434106445130256388	1434106445130256388	2021-09-04 16:19:55 IST	2021-09-04	16:19:55	+0530	1222156587055439872	garyandersonf1	Gary Anderson		Alonso v Bottas graph shows less fuel on board the Alpine	en	[]	[]	[]	0	4	52	[]	[]	https://twitter.com/GaryAndersonF1/status/1434106445130256388	False		0								[]				
1434102782831771650	1434102782831771650	2021-09-04 16:05:22 IST	2021-09-04	16:05:22	+0530	1222156587055439872	garyandersonf1	Gary Anderson		Vettel learning in T3 that banking can bite you if you need to correct an oversteer. There's lots more weight transfer when you have a banked corner, which means the front bites sooner	en	[]	[]	[]	1	7	81	[]	[]	https://twitter.com/GaryAndersonF1/status/1434102782831771650	False		0								[]				
1434101474229948418	1434101474229948418	2021-09-04 16:00:10 IST	2021-09-04	16:00:10	+0530	1222156587055439872	garyandersonf1	Gary Anderson		Perhaps we need more run-off area and to Tarmac those gravel traps so the drivers get away with a few more mistakes without paying the price? (joking)	en	[]	[]	[]	3	2	160	[]	[]	https://twitter.com/GaryAndersonF1/status/1434101474229948418	False		0								[]				
1433795684583591936	1433795684583591936	2021-09-03 19:45:04 IST	2021-09-03	19:45:04	+0530	1222156587055439872	garyandersonf1	Gary Anderson		As I said earlier, banked corners and oil tank pickups can cause a few headaches. Vettel and now Hamilton had oil pressure problems - and both use the same engine and oil tank	en	[]	[]	[]	42	154	1936	[]	[]	https://twitter.com/GaryAndersonF1/status/1433795684583591936	False		0								[]				
1433794942111993856	1433794942111993856	2021-09-03 19:42:07 IST	2021-09-03	19:42:07	+0530	1222156587055439872	garyandersonf1	Gary Anderson		In 1985, which is 36 years ago, Nelson Piquet in his Brabham-BMW was on pole position at Zandvoort with a 1:11.074s lap	en	[]	[]	[]	5	17	137	[]	[]	https://twitter.com/GaryAndersonF1/status/1433794942111993856	False		0								[]				
1433786099810324481	1433786099810324481	2021-09-03 19:06:59 IST	2021-09-03	19:06:59	+0530	1222156587055439872	garyandersonf1	Gary Anderson		This one justifies a red flag. Red mist took over	en	[]	[]	[]	0	1	51	[]	[]	https://twitter.com/GaryAndersonF1/status/1433786099810324481	False		0								[]				
1433783279019249665	1433783279019249665	2021-09-03 18:55:46 IST	2021-09-03	18:55:46	+0530	1222156587055439872	garyandersonf1	Gary Anderson		Oops, there is a grass snake crossing the track - quickly throw a red. What’s happened to yellow flags and/or VSC?	en	[]	[]	[]	4	1	153	[]	[]	https://twitter.com/GaryAndersonF1/status/1433783279019249665	False		0								[]				
1433736793208336403	1433736793208336403	2021-09-03 15:51:03 IST	2021-09-03	15:51:03	+0530	1222156587055439872	garyandersonf1	Gary Anderson		This is all a bit strange. It needs sorting before Sunday	en	[]	[]	[]	4	2	69	[]	[]	https://twitter.com/GaryAndersonF1/status/1433736793208336403	False		0								[]				
1433733877802151973	1433733877802151973	2021-09-03 15:39:28 IST	2021-09-03	15:39:28	+0530	1222156587055439872	garyandersonf1	Gary Anderson		The recovery could be faster	en	[]	[]	[]	10	1	83	[]	[]	https://twitter.com/GaryAndersonF1/status/1433733877802151973	False		0								[]				
1433730163225866264	1433730163225866264	2021-09-03 15:24:42 IST	2021-09-03	15:24:42	+0530	1222156587055439872	garyandersonf1	Gary Anderson		On banked corners with higher loading, the oil pick up position becomes critical. I wonder it that was anything to do with Vettel's problem?	en	[]	[]	[]	7	23	268	[]	[]	https://twitter.com/GaryAndersonF1/status/1433730163225866264	False		0								[]				
1433722564354977804	1433722564354977804	2021-09-03 14:54:31 IST	2021-09-03	14:54:31	+0530	1222156587055439872	garyandersonf1	Gary Anderson		Having watched F3 practice to see what the track looked like, I think F1 practice is going to be challenging and exciting. Don't be surprised if we see a few red flags	en	[]	[]	[]	4	13	104	[]	[]	https://twitter.com/GaryAndersonF1/status/1433722564354977804	False		0								[]				
1432010855495966724	1432010855495966724	2021-08-29 21:32:48 IST	2021-08-29	21:32:48	+0530	1222156587055439872	garyandersonf1	Gary Anderson		I have said this before, but if it was me I would send the cars out for one lap behind the safety car, then bring it in and allow the leader to dictate the pace. Run three laps with full yellows to move the water, then bunch them up and let them loose with a rolling start	en	[]	[]	[]	22	50	408	[]	[]	https://twitter.com/GaryAndersonF1/status/1432010855495966724	False		0								[]				
1432006036794269699	1432006036794269699	2021-08-29 21:13:39 IST	2021-08-29	21:13:39	+0530	1222156587055439872	garyandersonf1	Gary Anderson		In 1973, we had a very wet Canadian GP. Carlos Reutemann was driving for us at Brabham and had a helmet visor with a round spinning front on it driven by the airflow that threw the water off as it rotated. Perhaps we need to go back in time to be able to run in wet conditions?	en	[]	[]	[]	14	25	219	[]	[]	https://twitter.com/GaryAndersonF1/status/1432006036794269699	False		0								[]				
1431996673799163912	1431996673799163912	2021-08-29 20:36:26 IST	2021-08-29	20:36:26	+0530	1222156587055439872	garyandersonf1	Gary Anderson		These start procedure regulations seem to be getting re-written as teams ask new questions	en	[]	[]	[]	16	53	541	[]	[]	https://twitter.com/GaryAndersonF1/status/1431996673799163912	False		0								[]				
1431994774307934211	1431994774307934211	2021-08-29 20:28:54 IST	2021-08-29	20:28:54	+0530	1222156587055439872	garyandersonf1	Gary Anderson		This has come about from Q3 yesterday when the drivers were saying it should be red flagged. The FIA didn't react and Norris crashed. I've said many times that all competing drivers that have won an F1 title should make the decisions and not someone who has never sat in an F1 car	en	[]	[]	[]	5	41	353	[]	[]	https://twitter.com/GaryAndersonF1/status/1431994774307934211	False		0								[]				
1431992794722226177	1431992794722226177	2021-08-29 20:21:02 IST	2021-08-29	20:21:02	+0530	1222156587055439872	garyandersonf1	Gary Anderson		In reality, it's very simple. Timing-wise, everything should start to count when the cars head off on the formation lap, which is always on the hour. Race laps should count from when the lights go out or, in the case of a safety car start, when the cars complete the formation lap	en	[]	[]	[]	5	19	169	[]	[]	https://twitter.com/GaryAndersonF1/status/1431992794722226177	False		0								[]				
1431990028826202118	1431990028826202118	2021-08-29 20:10:02 IST	2021-08-29	20:10:02	+0530	1222156587055439872	garyandersonf1	Gary Anderson		This lap count thing is very strange. Never ever heard of a lap reduction for delayed starts! I think the FIA have made a farce out of their own race-procedure regulations	en	[]	[]	[]	32	113	851	[]	[]	https://twitter.com/GaryAndersonF1/status/1431990028826202118	False		0								[]				
1431980354123010048	1431980354123010048	2021-08-29 19:31:35 IST	2021-08-29	19:31:35	+0530	1222156587055439872	garyandersonf1	Gary Anderson		The pitlane opens for 20 minutes. Perez got out in that time but didn't come back. He had outside assistance to come back to the pitlane. If they can fix it in time, he needs to start from the pitlane	en	[]	[]	[]	13	44	262	[]	[]	https://twitter.com/GaryAndersonF1/status/1431980354123010048	False		0								[]				
1431976033784377347	1431976033784377347	2021-08-29 19:14:25 IST	2021-08-29	19:14:25	+0530	1222156587055439872	garyandersonf1	Gary Anderson		I think everyone is a bit confused with all this, especially Mr Masi!	en	[]	[]	[]	12	23	420	[]	[]	https://twitter.com/GaryAndersonF1/status/1431976033784377347	False		0								[]				
1431965444269879298	1431965444269879298	2021-08-29 18:32:21 IST	2021-08-29	18:32:21	+0530	1222156587055439872	garyandersonf1	Gary Anderson		Everyone sitting there with their tyres getting cold. 10 minutes is not enough to get anything up to temperature	en	[]	[]	[]	3	10	103	[]	[]	https://twitter.com/GaryAndersonF1/status/1431965444269879298	False		0								[]				
1431631811034112009	1431631811034112009	2021-08-28 20:26:36 IST	2021-08-28	20:26:36	+0530	1222156587055439872	garyandersonf1	Gary Anderson		Love it! Well done Williams and George Russell	en	[]	[]	[]	4	15	600	[]	[]	https://twitter.com/GaryAndersonF1/status/1431631811034112009	False		0								[]				
